"Petrinovic, I.A., Martí, J., Aguirre-Díaz, G.J., Guzmán, S., Geyer, A., Paz, N.S.","6506255880;7202923564;6602627475;14919111600;14423925500;36165752500;","The Cerro Aguas Calientes caldera, NW Argentina: An example of a tectonically controlled, polygenetic collapse caldera, and its regional significance",2010,"Journal of Volcanology and Geothermal Research","194","1-3",,"15","26",,58,"10.1016/j.jvolgeores.2010.04.012","https://www.scopus.com/inward/record.uri?eid=2-s2.0-77953696188&doi=10.1016%2fj.jvolgeores.2010.04.012&partnerID=40&md5=ec1803c796ef41dec2912323b55de66b",Article,"Final","",Scopus,2-s2.0-77953696188
"Borthagaray, A.I., Fuentes, M.A., Marquet, P.A.","8982534400;7103214198;7102630622;","Vegetation pattern formation in a fog-dependent ecosystem",2010,"Journal of Theoretical Biology","265","1",,"18","26",,56,"10.1016/j.jtbi.2010.04.020","https://www.scopus.com/inward/record.uri?eid=2-s2.0-77953615311&doi=10.1016%2fj.jtbi.2010.04.020&partnerID=40&md5=f22b1958d0bec69f20510148bde88bfd",Article,"Final","",Scopus,2-s2.0-77953615311
"Urrutia, R., Araneda, A., Torres, L., Cruces, F., Vivero, C., Torrejón, F., Barra, R., Fagel, N., Scharf, B.","56273296500;55949206400;12241049200;8406033700;36086866500;23010395600;7003677477;6603961980;7005695557;","Late Holocene environmental changes inferred from diatom, chironomid, and pollen assemblages in an Andean lake in Central Chile, Lake Laja (36°S)",2010,"Hydrobiologia","648","1",,"207","225",,15,"10.1007/s10750-010-0264-1","https://www.scopus.com/inward/record.uri?eid=2-s2.0-77952010826&doi=10.1007%2fs10750-010-0264-1&partnerID=40&md5=b06bac91f2039f33e1d3d5b0f5216f4d",Article,"Final","",Scopus,2-s2.0-77952010826
"Azúa-Bustos, A., González-Silva, C., Salas, L., Palma, R.E., Vicuña, R.","26038934900;35098616700;7006018293;7006981193;7005907711;","A novel subaerial Dunaliella species growing on cave spiderwebs in the Atacama Desert",2010,"Extremophiles","14","5",,"443","452",,30,"10.1007/s00792-010-0322-7","https://www.scopus.com/inward/record.uri?eid=2-s2.0-77956416578&doi=10.1007%2fs00792-010-0322-7&partnerID=40&md5=dddff82fd507b8ed0e360e6bc338a061",Article,"Final","",Scopus,2-s2.0-77956416578
"Vítek, P., Edwards, H.G.M., Jehlička, J., Ascaso, C., De Los Ríos, A., Valea, S., Jorge-Villar, S.E., Davila, A.F., Wierzchos, J.","36351336400;7202660467;6603798548;7005936696;7004184904;36351363600;6602409926;7006340868;7003681791;","Microbial colonization of halite from the hyper-arid atacama desert studied by Raman spectroscopy",2010,"Philosophical Transactions of the Royal Society A: Mathematical, Physical and Engineering Sciences","368","1922",,"3205","3221",,72,"10.1098/rsta.2010.0059","https://www.scopus.com/inward/record.uri?eid=2-s2.0-77955199005&doi=10.1098%2frsta.2010.0059&partnerID=40&md5=403f4ef24106cad44f49b7aa2a1234ce",Article,"Final","All Open Access, Bronze, Green",Scopus,2-s2.0-77955199005
"Schlunegger, F., Kober, F., Zeilinger, G., von Rotz, R.","6603813465;8591213500;6701652365;14020799700;","Sedimentology-based reconstructions of paleoclimate changes in the Central Andes in response to the uplift of the Andes, Arica region between 19 and 21°S latitude, northern Chile",2010,"International Journal of Earth Sciences","99","SUPPL. 1",,"123","137",,28,"10.1007/s00531-010-0572-8","https://www.scopus.com/inward/record.uri?eid=2-s2.0-77956278097&doi=10.1007%2fs00531-010-0572-8&partnerID=40&md5=3da3e2bd830cd9ee792dc25faccbbb15",Article,"Final","All Open Access, Green",Scopus,2-s2.0-77956278097
"Wagner, S.","57199818926;","'Unconventional' drilling could free trapped Chilean miners",2010,"Engineer","AUGUST",,,"","",3,,,"https://www.scopus.com/inward/record.uri?eid=2-s2.0-78651292776&partnerID=40&md5=1142c306d7873f1ed6b205be0888193b",Article,"Final","",Scopus,2-s2.0-78651292776
"Regard, V., Saillard, M., Martinod, J., Audin, L., Carretier, S., Pedoja, K., Riquelme, R., Paredes, P., Hérail, G.","36094627300;15748016800;55897139800;7005114252;6603118126;15078506700;56228802300;49061336300;7004202642;","Renewed uplift of the Central Andes Forearc revealed by coastal evolution during the Quaternary",2010,"Earth and Planetary Science Letters","297","1-2",,"199","210",,64,"10.1016/j.epsl.2010.06.020","https://www.scopus.com/inward/record.uri?eid=2-s2.0-77956009550&doi=10.1016%2fj.epsl.2010.06.020&partnerID=40&md5=6042cc3ad9d331cc11701e54144d6cd1",Article,"Final","All Open Access, Green",Scopus,2-s2.0-77956009550
"Messager, G., Nivière, B., Martinod, J., Lacan, P., Xavier, J.-P.","36198519100;55948935900;55897139800;22734285600;7007007278;","Geomorphic evidence for Plio-Quaternary compression in the Andean foothills of the southern Neuqun Basin, Argentina",2010,"Tectonics","29","4","TC4003","","",,45,"10.1029/2009TC002609","https://www.scopus.com/inward/record.uri?eid=2-s2.0-77955209854&doi=10.1029%2f2009TC002609&partnerID=40&md5=8877ffcd6a7cd5dcc36d972724a1a87f",Article,"Final","All Open Access, Green",Scopus,2-s2.0-77955209854
"Welkner, D., Eberhardt, E., Hermanns, R.L.","10040191200;24536835600;6603434500;","Hazard investigation of the Portillo Rock Avalanche site, central Andes, Chile, using an integrated field mapping and numerical modelling approach",2010,"Engineering Geology","114","3-4",,"278","297",,39,"10.1016/j.enggeo.2010.05.007","https://www.scopus.com/inward/record.uri?eid=2-s2.0-77955171722&doi=10.1016%2fj.enggeo.2010.05.007&partnerID=40&md5=e3ae5b5e041208fba8389e6f48d94c06",Article,"Final","",Scopus,2-s2.0-77955171722
"Flores-Aqueveque, V., Alfaro, S., Muñoz, R., Rutllant, J.A., Caquineau, S., Le Roux, J.P., Vargas, G.","35955868100;7003679485;7202035883;7003372165;6507469404;7102297218;7005493806;","Aeolian erosion and sand transport over the Mejillones Pampa in the coastal Atacama Desert of northern Chile",2010,"Geomorphology","120","3-4",,"312","325",,19,"10.1016/j.geomorph.2010.04.003","https://www.scopus.com/inward/record.uri?eid=2-s2.0-77954816087&doi=10.1016%2fj.geomorph.2010.04.003&partnerID=40&md5=ce9149cf9e286783c0a52a5107453550",Article,"Final","",Scopus,2-s2.0-77954816087
"Saillard, M., Hall, S.R., Audin, L., Farber, D.L., Martinod, J., Regard, V., Pedoja, K., Hérail, G.","15748016800;24366724000;7005114252;35581716700;55897139800;36094627300;15078506700;7004202642;","Reply to a Comment on ""Non-steady long-term uplift rates and Pleistocene marine terrace development along the Andean margin of Chile (31°S) inferred from 10Be dating"" by M. Saillard, S.R. Hall, L. Audin, D.L. Farber, G. Hérail, J. Martinod, V. Regard, R.C. Finkel. and F. Bondoux [Earth Planet. Sci. Lett. 277 (2009) 50-63]",2010,"Earth and Planetary Science Letters","296","3-4",,"506","509",,4,"10.1016/j.epsl.2010.05.017","https://www.scopus.com/inward/record.uri?eid=2-s2.0-77954660718&doi=10.1016%2fj.epsl.2010.05.017&partnerID=40&md5=08ff54c5c670e9cf0a9fb8af6a0735d2",Note,"Final","",Scopus,2-s2.0-77954660718
"Hernández, A., Giralt, S., Bao, R., Sáez, A., Leng, M.J., Barker, P.A.","24334975500;7007002237;7004679878;57202439533;7006497331;7402080530;","ENSO and solar activity signals from oxygen isotopes in diatom silica during late glacial-Holocene transition in central Andes (18°S)",2010,"Journal of Paleolimnology","44","2",,"413","429",,13,"10.1007/s10933-010-9412-x","https://www.scopus.com/inward/record.uri?eid=2-s2.0-77954657587&doi=10.1007%2fs10933-010-9412-x&partnerID=40&md5=cd7cc213b044ea35047478aa0a869ce5",Article,"Final","All Open Access, Green",Scopus,2-s2.0-77954657587
"Dorador, C., Vila, I., Remonsellez, F., Imhoff, J.F., Witzel, K.-P.","23666723800;6701661179;25639992100;7005354833;7004266095;","Unique clusters of Archaea in Salar de Huasco, an athalassohaline evaporitic basin of the Chilean Altiplano",2010,"FEMS Microbiology Ecology","73","2",,"291","302",,55,"10.1111/j.1574-6941.2010.00891.x","https://www.scopus.com/inward/record.uri?eid=2-s2.0-77954413876&doi=10.1111%2fj.1574-6941.2010.00891.x&partnerID=40&md5=4bdea48009e15111f6c03258b0f750ed",Article,"Final","All Open Access, Bronze",Scopus,2-s2.0-77954413876
"Baker, R.G.A., Rehkämper, M., Ihlenfeld, C., Oates, C.J., Coggon, R.","55452039700;7003837574;25823806700;16313262200;8146739600;","Thallium isotope variations in an ore-bearing continental igneous setting: Collahuasi Formation, northern Chile",2010,"Geochimica et Cosmochimica Acta","74","15",,"4405","4416",,28,"10.1016/j.gca.2010.04.068","https://www.scopus.com/inward/record.uri?eid=2-s2.0-77953957778&doi=10.1016%2fj.gca.2010.04.068&partnerID=40&md5=288d5e4c27ceeb2e64ffe37a429926dd",Article,"Final","",Scopus,2-s2.0-77953957778
"Kral, S.","23028039600;","Remarkable rescue unfolds",2010,"Mining Engineering","62","9",,"96","",,1,,"https://www.scopus.com/inward/record.uri?eid=2-s2.0-78349242184&partnerID=40&md5=db10e842991eebec61bf71216444c812",Short Survey,"Final","",Scopus,2-s2.0-78349242184
"Gould, B.A., León, B., Buffen, A.M., Thompson, L.G.","16642438900;7005500144;15135112900;7403729580;","Evidence of a high-andean, mid-holocene plant community: An ancient DNA analysis of glacially preserved remains",2010,"American Journal of Botany","97","9",,"1579","1584",,14,"10.3732/ajb.1000058","https://www.scopus.com/inward/record.uri?eid=2-s2.0-78049276350&doi=10.3732%2fajb.1000058&partnerID=40&md5=990c11fcde780b9845e873191374dd81",Article,"Final","",Scopus,2-s2.0-78049276350
"Murphy, A., Llano, R.","57199723378;36716511700;","Father COPPER",2010,"Virginia Quarterly Review","86","4",,"70","73+76-77+80-88",,,,"https://www.scopus.com/inward/record.uri?eid=2-s2.0-77957839799&partnerID=40&md5=7bf1afd060533c1b96b9aad5e3685570",Review,"Final","",Scopus,2-s2.0-77957839799
"Murray, B.P., Horton, B.K., Matos, R., Heizler, M.T.","36502124700;7006721107;24822529700;7003586301;","Oligocene-Miocene basin evolution in the Northern Altiplano, Bolivia: Implications for evolution of the central Andean backthrust belt and high plateau",2010,"Bulletin of the Geological Society of America","122","9-10",,"1443","1462",,22,"10.1130/B30129.1","https://www.scopus.com/inward/record.uri?eid=2-s2.0-77957030831&doi=10.1130%2fB30129.1&partnerID=40&md5=d14e96f8f814d3aacf827eb9cc084bdb",Article,"Final","",Scopus,2-s2.0-77957030831
"González, M.E., Veblen, T.T., Sibold, J.S.","8517967900;7005710296;6506579671;","Influence of fire severity on stand development of Araucaria araucana-Nothofagus pumilio stands in the Andean cordillera of south-central Chile",2010,"Austral Ecology","35","6",,"597","615",,35,"10.1111/j.1442-9993.2009.02064.x","https://www.scopus.com/inward/record.uri?eid=2-s2.0-77956161309&doi=10.1111%2fj.1442-9993.2009.02064.x&partnerID=40&md5=0946dcc18e28acf4eec6c2a5288632f3",Article,"Final","",Scopus,2-s2.0-77956161309
"Lehr, E., Catenazzi, A.","7003323573;57197741395;","Two new species of bryophryne (Anura: Strabomantidae) from high elevations in Southern Peru (Region of Cusco)",2010,"Herpetologica","66","3",,"308","319",,16,"10.1655/09-038.1","https://www.scopus.com/inward/record.uri?eid=2-s2.0-77956026484&doi=10.1655%2f09-038.1&partnerID=40&md5=434e16c3756a5ed3745a99cf48e9a260",Article,"Final","",Scopus,2-s2.0-77956026484
"Valencia, B.G., Urrego, D.H., Silman, M.R., Bush, M.B.","25222135800;10639674700;6602205640;55951088700;","From ice age to modern: A record of landscape change in an Andean cloud forest",2010,"Journal of Biogeography","37","9",,"1637","1647",,52,"10.1111/j.1365-2699.2010.02318.x","https://www.scopus.com/inward/record.uri?eid=2-s2.0-77955597973&doi=10.1111%2fj.1365-2699.2010.02318.x&partnerID=40&md5=9f8c62eb3faa12dc802ac2baca3a892a",Article,"Final","",Scopus,2-s2.0-77955597973
"Haug, E.W., Kraal, E.R., Sewall, J.O., Van Dijk, M., Diaz, G.C.","36243497600;8371312500;6602840494;57197424642;7201671416;","Climatic and geomorphic interactions on alluvial fans in the Atacama Desert, Chile",2010,"Geomorphology","121","3-4",,"184","196",,14,"10.1016/j.geomorph.2010.04.005","https://www.scopus.com/inward/record.uri?eid=2-s2.0-77954761258&doi=10.1016%2fj.geomorph.2010.04.005&partnerID=40&md5=2629446e8992c95d7b912479fddc9ec9",Article,"Final","All Open Access, Green",Scopus,2-s2.0-77954761258
"Lau, G.F.","8417048800;","House forms and Recuay culture: Residential compounds at Yayno (Ancash, Peru), a fortified hilltop town, AD 400-800",2010,"Journal of Anthropological Archaeology","29","3",,"327","351",,19,"10.1016/j.jaa.2010.04.003","https://www.scopus.com/inward/record.uri?eid=2-s2.0-77954757171&doi=10.1016%2fj.jaa.2010.04.003&partnerID=40&md5=2d25b1e73f1c20e26b6c283f5ad19199",Article,"Final","",Scopus,2-s2.0-77954757171
"Gibbon, A., Silman, M.R., Malhi, Y., Fisher, J.B., Meir, P., Zimmermann, M., Dargie, G.C., Farfan, W.R., Garcia, K.C.","35767679900;6602205640;7004035832;7404016992;6602529747;55896917400;35767339900;55857096100;35767749800;","Ecosystem Carbon Storage Across the Grassland-Forest Transition in the High Andes of Manu National Park, Peru",2010,"Ecosystems","13","7",,"1097","1111",,70,"10.1007/s10021-010-9376-8","https://www.scopus.com/inward/record.uri?eid=2-s2.0-77957754746&doi=10.1007%2fs10021-010-9376-8&partnerID=40&md5=e2ad42c52d8edeef515ed67b8b953670",Article,"Final","",Scopus,2-s2.0-77957754746
"Seth, A., Thibeault, J., Garcia, M., Valdivia, C.","7103146552;36009516200;55464718700;6701904068;","Making sense of twenty-first-century climate change in the Altiplano: Observed trends and CMIP3 projections",2010,"Annals of the Association of American Geographers","100","4",,"835","847",,29,"10.1080/00045608.2010.500193","https://www.scopus.com/inward/record.uri?eid=2-s2.0-77956764751&doi=10.1080%2f00045608.2010.500193&partnerID=40&md5=6c2aed62d35814da265eccd6c5608289",Article,"Final","",Scopus,2-s2.0-77956764751
"Valdivia, C., Seth, A., Gilles, J.L., García, M., Jiménez, E., Cusicanqui, J., Navia, F., Yucra, E.","6701904068;7103146552;7005416851;55464718700;35725740100;23097096400;36487076100;23986916200;","Adapting to climate change in Andean ecosystems: Landscapes, capitals, and perceptions shaping rural livelihood strategies and linking knowledge systems",2010,"Annals of the Association of American Geographers","100","4",,"818","834",,119,"10.1080/00045608.2010.500198","https://www.scopus.com/inward/record.uri?eid=2-s2.0-77956715480&doi=10.1080%2f00045608.2010.500198&partnerID=40&md5=d288c391d2559faa71049af9d589d491",Article,"Final","",Scopus,2-s2.0-77956715480
"Malcherek, T., Schlüter, J.","55884870700;7004649130;","Anatacamite from La Vendida mine, Sierra Gorda, Atacama desert, Chile: A triclinic polymorph of Cu2(OH)3CI",2010,"Neues Jahrbuch fur Mineralogie, Abhandlungen","187","3",,"307","312",,7,"10.1127/0077-7757/2010/0180","https://www.scopus.com/inward/record.uri?eid=2-s2.0-78649618980&doi=10.1127%2f0077-7757%2f2010%2f0180&partnerID=40&md5=99a5af19635c44473df0a841b59845ad",Article,"Final","",Scopus,2-s2.0-78649618980
"Edgington, S., Buddie, A.G., Moore, D., France, A., Merino, L., Tymo, L.M., Hunt, D.J.","57206446584;6602672005;55251371100;22133922000;23135318800;33568468500;7402464305;","Diversity and distribution of entomopathogenic nematodes in Chile",2010,"Nematology","12","6",,"915","928",,18,"10.1163/138855410X498897","https://www.scopus.com/inward/record.uri?eid=2-s2.0-78149306470&doi=10.1163%2f138855410X498897&partnerID=40&md5=2149c3f4b4f8021b88de751d6caf35d2",Article,"Final","",Scopus,2-s2.0-78149306470
"Di Gregorio, B.","36570288100;","Looking for life on mars",2010,"Chemical Engineer",,"832",,"32","34",,,,"https://www.scopus.com/inward/record.uri?eid=2-s2.0-77958084238&partnerID=40&md5=dbe8e9543c2734cc6740969896e5a929",Article,"Final","",Scopus,2-s2.0-77958084238
"Jordan, T.E., Nester, P.L., Blanco, N., Hoke, G.D., Dávila, F., Tomlinson, A.J.","7202381241;6507620314;23099464100;7003530133;6603700705;7101953404;","Uplift of the Altiplano-Puna plateau: A view from the west",2010,"Tectonics","29","5","TC5007","","",,109,"10.1029/2010TC002661","https://www.scopus.com/inward/record.uri?eid=2-s2.0-77957570728&doi=10.1029%2f2010TC002661&partnerID=40&md5=3f8efe098fd386744d37b80647daa810",Article,"Final","All Open Access, Bronze, Green",Scopus,2-s2.0-77957570728
"Rieger, A.A., Marschik, R., Díaz, M., Hölzl, S., Chiaradia, M., Akker, B., Spangenberg, J.E.","24476696400;6603162051;37057021900;6508009916;7003564558;37057161500;7006219454;","The hypogene iron oxide copper-gold mineralization in the Mantoverde district, northern Chile",2010,"Economic Geology","105","7",,"1271","1299",,41,"10.2113/econgeo.105.7.1271","https://www.scopus.com/inward/record.uri?eid=2-s2.0-79952374044&doi=10.2113%2fecongeo.105.7.1271&partnerID=40&md5=de3d9f69f2fc033eadb3f58fa50a66e4",Article,"Final","",Scopus,2-s2.0-79952374044
"Van Den Bergh, K., Du Laing, G., Montoya, J.C., De Deckere, E., Tack, F.M.G.","37008825800;8448278200;37008640500;7004243544;7005864023;","Arsenic in drinking water wells on the Bolivian high plain: Field monitoring and effect of salinity on removal efficiency of iron-oxides- containing filters",2010,"Journal of Environmental Science and Health - Part A Toxic/Hazardous Substances and Environmental Engineering","45","13",,"1741","1749",,19,"10.1080/10934529.2010.513262","https://www.scopus.com/inward/record.uri?eid=2-s2.0-79952277345&doi=10.1080%2f10934529.2010.513262&partnerID=40&md5=370d669abf9dfe4711c464797e9157d2",Article,"Final","All Open Access, Green",Scopus,2-s2.0-79952277345
"Moraga, A.C.","36337772000;","A sacred mountain and the art of ""impression management"": Analyzing a mining company's encounter with indigenous communities in Atacama, Chile",2010,"Mountain Research and Development","30","4",,"391","397",,7,"10.1659/MRD-JOURNAL-D-09-00065.1","https://www.scopus.com/inward/record.uri?eid=2-s2.0-78649495047&doi=10.1659%2fMRD-JOURNAL-D-09-00065.1&partnerID=40&md5=8b894be50faff616c99786f027a085ba",Article,"Final","All Open Access, Gold, Green",Scopus,2-s2.0-78649495047
"Fugal, R.A., Anderson, V.J., Roundy, B.","36456893900;7202558435;7003475354;","Exotic grass and shrub production evaluation and llama preference on the Bolivian Altiplano",2010,"Small Ruminant Research","94","1-3",,"150","160",,4,"10.1016/j.smallrumres.2010.07.019","https://www.scopus.com/inward/record.uri?eid=2-s2.0-78049424447&doi=10.1016%2fj.smallrumres.2010.07.019&partnerID=40&md5=dfb5c1089f60f361ae454e59b1d4f614",Article,"Final","",Scopus,2-s2.0-78049424447
"Bissig, T., Riquelme, R.","6603249897;56228802300;","Andean uplift and climate evolution in the southern Atacama Desert deduced from geomorphology and supergene alunite-group minerals",2010,"Earth and Planetary Science Letters","299","3-4",,"447","457",,28,"10.1016/j.epsl.2010.09.028","https://www.scopus.com/inward/record.uri?eid=2-s2.0-78049294685&doi=10.1016%2fj.epsl.2010.09.028&partnerID=40&md5=44ad533ec96a20ff302feffbabc82fd3",Article,"Final","",Scopus,2-s2.0-78049294685
"Martinod, J., Husson, L., Roperch, P., Guillaume, B., Espurt, N.","55897139800;36449031800;6603475636;23980020900;16645598300;","Horizontal subduction zones, convergence velocity and the building of the Andes",2010,"Earth and Planetary Science Letters","299","3-4",,"299","309",,143,"10.1016/j.epsl.2010.09.010","https://www.scopus.com/inward/record.uri?eid=2-s2.0-78049291379&doi=10.1016%2fj.epsl.2010.09.010&partnerID=40&md5=b0dd39a32b9cefe50562280cfa6fda77",Article,"Final","All Open Access, Green",Scopus,2-s2.0-78049291379
"Otamendi, J.E., Pinotti, L.P., Basei, M.A.S., Tibaldi, A.M.","6603624937;6603042221;6602668732;7003575367;","Evaluation of petrogenetic models for intermediate and silicic plutonic rocks from the Sierra de Valle Fértil-La Huerta, Argentina: Petrologic constraints on the origin of igneous rocks in the Ordovician Famatinian-Puna paleoarc",2010,"Journal of South American Earth Sciences","30","1",,"29","45",,26,"10.1016/j.jsames.2010.07.004","https://www.scopus.com/inward/record.uri?eid=2-s2.0-77958082154&doi=10.1016%2fj.jsames.2010.07.004&partnerID=40&md5=2dded229264fea98644eab68a8f6e432",Article,"Final","",Scopus,2-s2.0-77958082154
"Reich, M., Chryssoulis, S.L., Deditius, A., Palacios, C., Zúñiga, A., Weldt, M., Alvear, M.","35389550600;7003888074;19640043300;7006887862;8342825400;36451706200;26427970500;",""" Invisible"" silver and gold in supergene digenite (Cu1.8S)",2010,"Geochimica et Cosmochimica Acta","74","21",,"6157","6173",,61,"10.1016/j.gca.2010.07.026","https://www.scopus.com/inward/record.uri?eid=2-s2.0-77956881930&doi=10.1016%2fj.gca.2010.07.026&partnerID=40&md5=ada61995c5c84cb9e968720ea6866f80",Article,"Final","",Scopus,2-s2.0-77956881930
"Ruggieri, F., Saavedra, J., Fernandez-Turiel, J.L., Gimeno, D., Garcia-Valles, M.","25926081000;7202229189;7003843565;56232012600;55963465800;","Environmental geochemistry of ancient volcanic ashes",2010,"Journal of Hazardous Materials","183","1-3",,"353","365",,43,"10.1016/j.jhazmat.2010.07.032","https://www.scopus.com/inward/record.uri?eid=2-s2.0-77956438063&doi=10.1016%2fj.jhazmat.2010.07.032&partnerID=40&md5=dde2e1a32096ee2066f08ff8e48ac393",Article,"Final","All Open Access, Green",Scopus,2-s2.0-77956438063
"Schwarzer, C., Huamaní, F.C., Cano, A., La Torre, M.I., Weigend, M.","36497244700;36138739300;24450063900;36497091900;55894034200;","400 years for long-distance dispersal and divergence in the northern Atacama desert - Insights from the Huaynaputina pumice slopes of Moquegua, Peru",2010,"Journal of Arid Environments","74","11",,"1540","1551",,27,"10.1016/j.jaridenv.2010.05.034","https://www.scopus.com/inward/record.uri?eid=2-s2.0-77956225397&doi=10.1016%2fj.jaridenv.2010.05.034&partnerID=40&md5=1caa341128175e8da69b19c4ca9c40f8",Article,"Final","",Scopus,2-s2.0-77956225397
"Standen, V.G., Arriaza, B.T., Santoro, C.M., Romero, Á., Rothhammer, F.","6602356440;6602846124;7004920399;55437164000;7006806972;","Perimortem trauma in the Atacama Desert and social violence during the late Formative period (2500-1700 years BP)",2010,"International Journal of Osteoarchaeology","20","6",,"693","707",,11,"10.1002/oa.1095","https://www.scopus.com/inward/record.uri?eid=2-s2.0-77954532157&doi=10.1002%2foa.1095&partnerID=40&md5=d8c1d7169000192d96d9a1cf5221f7ce",Article,"Final","",Scopus,2-s2.0-77954532157
"Rao, B., Hatzinger, P.B., Böhlke, J.K., Sturchio, N.C., Andraski, B.J., Eckardt, F.D., Jackson, W.A.","7403489670;6602124610;7004491698;7004475068;6701364041;7004378829;7401888610;","Natural chlorate in the environment: Application of a new IC-ESI/MS/MS method with a Cl18O3- internal standard",2010,"Environmental Science and Technology","44","22",,"8429","8434",,63,"10.1021/es1024228","https://www.scopus.com/inward/record.uri?eid=2-s2.0-78449238658&doi=10.1021%2fes1024228&partnerID=40&md5=2511265b06983065e0ddcd11d9412a5e",Article,"Final","",Scopus,2-s2.0-78449238658
"Tassara, A.","6701640620;","Control of forearc density structure on megathrust shear strength along the Chilean subduction zone",2010,"Tectonophysics","495","1-2",,"34","47",,32,"10.1016/j.tecto.2010.06.004","https://www.scopus.com/inward/record.uri?eid=2-s2.0-78649713309&doi=10.1016%2fj.tecto.2010.06.004&partnerID=40&md5=aa307524f51e942edb60ee7dbba5727f",Article,"Final","",Scopus,2-s2.0-78649713309
"Juez-Larré, J., Kukowski, N., Dunai, T.J., Hartley, A.J., Andriessen, P.A.M.","9236415900;6603816792;6603584767;7102080781;7003349952;","Thermal and exhumation history of the Coastal Cordillera arc of northern Chile revealed by thermochronological dating",2010,"Tectonophysics","495","1-2",,"48","66",,27,"10.1016/j.tecto.2010.06.018","https://www.scopus.com/inward/record.uri?eid=2-s2.0-78649696282&doi=10.1016%2fj.tecto.2010.06.018&partnerID=40&md5=a9be38e803187c00d523b74b049157fb",Article,"Final","",Scopus,2-s2.0-78649696282
"Hartley, A.J., Evenstar, L.","7102080781;26653575300;","Cenozoic stratigraphic development in the north Chilean forearc: Implications for basin development and uplift history of the Central Andean margin",2010,"Tectonophysics","495","1-2",,"67","77",,34,"10.1016/j.tecto.2009.05.013","https://www.scopus.com/inward/record.uri?eid=2-s2.0-77957569918&doi=10.1016%2fj.tecto.2009.05.013&partnerID=40&md5=ba722b7c0b135a4b7d96d61ebf834c0b",Article,"Final","",Scopus,2-s2.0-77957569918
"Jennings, J.","15820797800;","Beyond wari walls",2010,"Beyond Wari Walls: Regional Perspectives on Middle Horizon Peru",,,,"1","18",,12,,"https://www.scopus.com/inward/record.uri?eid=2-s2.0-84899601188&partnerID=40&md5=3f750c74dc427f1a55b9209c0a965c9d",Book Chapter,"Final","",Scopus,2-s2.0-84899601188
"Klarich, E.A.","57195662394;","Behind the scenes and into the kitchen",2010,"Inside Ancient Kitchens: New Directions in the Study of Daily Meals and Feasts",,,,"1","15",,3,,"https://www.scopus.com/inward/record.uri?eid=2-s2.0-84898592055&partnerID=40&md5=32bcdc31e9452a5c752c6279eafb66e8",Book Chapter,"Final","",Scopus,2-s2.0-84898592055
"Watson, J.T., Ovalle, I.M., Arriaza, B.T.","55227272800;24069146900;6602846124;","Formative adaptations, diet, and oral health in the Azapa Valley of Northwest Chile",2010,"Latin American Antiquity","21","4",,"423","439",,15,"10.7183/1045-6635.21.4.423","https://www.scopus.com/inward/record.uri?eid=2-s2.0-84876135479&doi=10.7183%2f1045-6635.21.4.423&partnerID=40&md5=aaa033e93faf8ce8838dbc87b0a08c07",Article,"Final","",Scopus,2-s2.0-84876135479
"Santoro Prof., C.M., Williams, V.I., Valenzuela, D., Romero, Á., Standen Prof., V.G.","7004920399;15770198200;55809882400;55437164000;6602356440;","An archaeological perspective on the inka provincial administration of the south-central andes",2010,"Distant provinces in the inka empire: Toward a Deeper Understanding of Inka Imperialism",,,,"44","74",,32,,"https://www.scopus.com/inward/record.uri?eid=2-s2.0-84873872561&partnerID=40&md5=4686b3aab7ed58d0308aa53c5b46ee10",Book Chapter,"Final","",Scopus,2-s2.0-84873872561
