"Sepúlveda, M., Gutiérrez, S., Vallette, M.C., Standen, V.G., Arriaza, B.T., Cárcamo-Vega, J.J.","55218043300;56662805100;6506862009;6602356440;6602846124;56888758500;","Micro-Raman spectral identification of manganese oxides black pigments in an archaeological context in Northern Chile",2015,"Heritage Science","3","1","32","1","6",,24,"10.1186/s40494-015-0061-2","https://www.scopus.com/inward/record.uri?eid=2-s2.0-84943156087&doi=10.1186%2fs40494-015-0061-2&partnerID=40&md5=9f50b3f356bed1fba1edd6ed0a1e1034",Article,"Final","All Open Access, Gold",Scopus,2-s2.0-84943156087
"Herrera, S., Cisternas, L.A., Gálvez, E.D.","56810732300;6603665617;7006829940;","Simultaneous Design of Desalination Plants and Distribution Water Network",2015,"Computer Aided Chemical Engineering","37",,,"1193","1198",,9,"10.1016/B978-0-444-63577-8.50044-9","https://www.scopus.com/inward/record.uri?eid=2-s2.0-84940556652&doi=10.1016%2fB978-0-444-63577-8.50044-9&partnerID=40&md5=b74a4afb6aee4e0f32f252028d6c96ec",Book Chapter,"Final","",Scopus,2-s2.0-84940556652
"Vargas, H.A., Vargas-Ortiz, M., Huanca-Mamani, W.","14061478800;55577479900;6507340858;","First record of folivory on a newly documented host plant for the little known geometrid moth Eupithecia yubitzae Vargas&amp;Parra (Lepidoptera, Geometridae) in northern Chile",2015,"Revista Brasileira de Entomologia","59","2",,"121","123",,2,"10.1016/j.rbe.2015.02.013","https://www.scopus.com/inward/record.uri?eid=2-s2.0-84938943483&doi=10.1016%2fj.rbe.2015.02.013&partnerID=40&md5=27586591496d87bb7b0daa9ea3c7cbb9",Article,"Final","All Open Access, Gold, Green",Scopus,2-s2.0-84938943483
"Castro, J.F., Razmilic, V., Gomez-Escribano, J.P., Andrews, B., Asenjo, J.A., Bibb, M.J.","54396814200;55506154100;14420986200;35556534100;56908691200;7006370472;","Identification and heterologous expression of the chaxamycin biosynthesis gene cluster from Streptomyces leeuwenhoekii",2015,"Applied and Environmental Microbiology","81","17",,"5820","5831",,31,"10.1128/AEM.01039-15","https://www.scopus.com/inward/record.uri?eid=2-s2.0-84938812406&doi=10.1128%2fAEM.01039-15&partnerID=40&md5=11ace11953bee11b662bf550a5537308",Article,"Final","All Open Access, Hybrid Gold, Green",Scopus,2-s2.0-84938812406
"Morero, R.E., Chiarini, F.E., Urdampilleta, J., Barboza, G.E., Barrington, D.S.","55921596100;14051490800;9940539800;6701525125;7003893697;","Cytological study of Polystichum (Dryopteridaceae) species from southern South America",2015,"Australian Journal of Botany","63","5",,"403","414",,5,"10.1071/BT14287","https://www.scopus.com/inward/record.uri?eid=2-s2.0-84938807548&doi=10.1071%2fBT14287&partnerID=40&md5=aa1b981d039df246bde7ea9fceb461ae",Article,"Final","",Scopus,2-s2.0-84938807548
"Salvador, F., Monerris, J., Rochefort, L.","15833123600;53164534100;7003608882;","Peatlands of the Peruvian Puna ecoregion: Types, characteristics and disturbance",2015,"Mires and Peat","15",,"03","","",17,35,,"https://www.scopus.com/inward/record.uri?eid=2-s2.0-84938058960&partnerID=40&md5=21409c07635bd7edddad21772582d293",Article,"Final","",Scopus,2-s2.0-84938058960
"Muir, D.D., Barfod, D.N., Blundy, J.D., Rust, A.C., Sparks, R.S.J., Clarke, K.M.","37117505900;7801375041;7003751497;7003933929;7202344707;56924576300;","The temporal record of magmatism at Cerro Uturuncu, Bolivian Altiplano",2015,"Geological Society Special Publication","422","1",,"57","83",,23,"10.1144/SP422.1","https://www.scopus.com/inward/record.uri?eid=2-s2.0-84937940735&doi=10.1144%2fSP422.1&partnerID=40&md5=24179bfdf687d8e22df2291bb35251ec",Book Chapter,"Final","",Scopus,2-s2.0-84937940735
"Esparza, E., Hadzich, A., Kofer, W., Mithöfer, A., Cosio, E.G.","56568421600;56568240500;57195450749;6701348234;6603015733;","Bioactive Maca (Lepidium meyenii) alkamides are a result of traditional Andean postharvest drying practices",2015,"Phytochemistry","116","1",,"138","148",,60,"10.1016/j.phytochem.2015.02.030","https://www.scopus.com/inward/record.uri?eid=2-s2.0-84934889883&doi=10.1016%2fj.phytochem.2015.02.030&partnerID=40&md5=7cdd0f2e80f65f39feeaa718b2bf4d36",Article,"Final","All Open Access, Hybrid Gold",Scopus,2-s2.0-84934889883
"Réveillet, M., Rabatel, A., Gillet-Chaulet, F., Soruco, A.","56695241200;9276067100;16052463900;8321501200;","Simulations of changes to Glaciar Zongo, Bolivia (16° S), over the 21st century using a 3-D full-Stokes model and CMIP5 climate projections",2015,"Annals of Glaciology","56","70",,"89","97",,26,"10.3189/2015AoG70A113","https://www.scopus.com/inward/record.uri?eid=2-s2.0-84932158898&doi=10.3189%2f2015AoG70A113&partnerID=40&md5=829da4fd5f5ce47748e4ad4112328b85",Article,"Final","All Open Access, Bronze",Scopus,2-s2.0-84932158898
"Fiorella, R.P., Poulsen, C.J., Pillco Zolá, R.S., Barnes, J.B., Tabor, C.R., Ehlers, T.A.","55934848500;7005902717;56786364600;14015069600;56001394200;7004047521;","Spatiotemporal variability of modern precipitation δ 18 O in the central Andes and implications for paleoclimate and paleoaltimetry estimates",2015,"Journal of Geophysical Research","120","10",,"4630","4656",,45,"10.1002/2014JD022893","https://www.scopus.com/inward/record.uri?eid=2-s2.0-84932151385&doi=10.1002%2f2014JD022893&partnerID=40&md5=636830c7e1edc4457c8e6e16b3a3c2a4",Article,"Final","All Open Access, Green",Scopus,2-s2.0-84932151385
"Cámara, B., Suzuki, S., Nealson, K.H., Wierzchos, J., Ascaso, C., Artieda, O., de los Ríos, A.","24330912000;55622439800;7006660618;7003681791;7005936696;6503931106;7004184904;","Ignimbrite textural properties as determinants of endolithic colonization patterns from hyper-arid Atacama Desert",2015,"International Microbiology","17","4",,"235","247",,14,"10.2436/20.1501.01.226","https://www.scopus.com/inward/record.uri?eid=2-s2.0-84932126816&doi=10.2436%2f20.1501.01.226&partnerID=40&md5=8118e8485a64bc261b5ac46ae579095c",Article,"Final","",Scopus,2-s2.0-84932126816
"Torres, V.M., Pardo, P.L., González-Reyes, A.X., Rodriguez-Artigas, S.M., Corronca, J.A.","56673663200;56673842700;16312377700;56516972600;6603245214;","New records of seven species of pholcid spiders (Araneae, pholcidae) from the northern Argentina",2015,"Check List","11","3","1629","","",9,2,"10.15560/11.3.1629","https://www.scopus.com/inward/record.uri?eid=2-s2.0-84930618559&doi=10.15560%2f11.3.1629&partnerID=40&md5=c70145d3c6714ca6e074e80c9f87d088",Article,"Final","All Open Access, Gold, Green",Scopus,2-s2.0-84930618559
"Araya, J.F., Araya, M.E.","56004763800;56664045200;","The shallow-water chitons (Mollusca, Polyplacophora) of Caldera, Region of Atacama, northern Chile",2015,"Zoosystematics and Evolution","91","1",,"45","58",,20,"10.3897/zse.91.8536","https://www.scopus.com/inward/record.uri?eid=2-s2.0-84930255161&doi=10.3897%2fzse.91.8536&partnerID=40&md5=b771ca6e70b7ee6adb00301bd412122a",Article,"Final","All Open Access, Gold, Green",Scopus,2-s2.0-84930255161
"Maggard, G.J.","6506947576;","The el palto phase of Northern Perú: Cultural diversity in the late pleistocene-early holocene",2015,"Chungara","47","1",,"25","40",,12,,"https://www.scopus.com/inward/record.uri?eid=2-s2.0-84929413550&partnerID=40&md5=012253106ff7607e666754a487d32d64",Article,"Final","",Scopus,2-s2.0-84929413550
"Martí-Herrero, J., Ceron, M., Garcia, R., Pracejus, L., Alvarez, R., Cipriano, X.","47862084100;56644501600;57225979022;56644676500;10143957400;26038994000;","The influence of users' behavior on biogas production from low cost tubular digesters: A technical and socio-cultural field analysis",2015,"Energy for Sustainable Development","27",,,"73","83",,23,"10.1016/j.esd.2015.05.003","https://www.scopus.com/inward/record.uri?eid=2-s2.0-84929305304&doi=10.1016%2fj.esd.2015.05.003&partnerID=40&md5=bc738cbf45e4061489d2914ae2ff6dd3",Article,"Final","",Scopus,2-s2.0-84929305304
"Kleier, C., Trenary, T., Graham, E.A., Stenzel, W., Rundel, P.W.","6602994792;56584539400;7202160055;56583879500;7004152561;","Size class structure, growth rates, and orientation of the central Andean cushion Azorella compacta",2015,"PeerJ","2015","3","e843","","",,12,"10.7717/peerj.843","https://www.scopus.com/inward/record.uri?eid=2-s2.0-84926483369&doi=10.7717%2fpeerj.843&partnerID=40&md5=b4906483b6125a470155d9a0379e92d8",Article,"Final","All Open Access, Gold, Green",Scopus,2-s2.0-84926483369
"Swift, J., Cupper, M.L., Greig, A., Westaway, M.C., Carter, C., Santoro, C.M., Wood, R., Jacobsen, G.E., Bertuch, F.","55599201400;6506079430;7005214680;57202564941;57198466970;7004920399;35202563700;7102705035;34881456600;","Skeletal arsenic of the pre-Columbian population of Caleta Vitor, northern Chile",2015,"Journal of Archaeological Science","58",,,"31","45",,21,"10.1016/j.jas.2015.03.024","https://www.scopus.com/inward/record.uri?eid=2-s2.0-84926431537&doi=10.1016%2fj.jas.2015.03.024&partnerID=40&md5=9b5f1de0e23aed8c1a91ee13dcbfce17",Article,"Final","",Scopus,2-s2.0-84926431537
"Costa, C.H., Ahumada, E.A., Gardini, C.E., Vázquez, F.R., Diederix, H.","56248887800;24447957300;6505916794;56553739100;6507042149;","Quaternary shortening at the orogenic front of the Central Andes of Argentina: The las peñas thrust system",2015,"Geological Society Special Publication","399",,,"245","266",,13,"10.1144/SP399.5","https://www.scopus.com/inward/record.uri?eid=2-s2.0-84924901850&doi=10.1144%2fSP399.5&partnerID=40&md5=fef6b37da1d1c5b787f9396d8bb25d67",Article,"Final","",Scopus,2-s2.0-84924901850
"Moreiras, S.M., Sepúlveda, S.A.","8240633800;8694415200;","Megalandslides in the Andes of central Chile and Argentina (32°-34°S) and potential hazards",2015,"Geological Society Special Publication","399",,,"329","344",,25,"10.1144/SP399.18","https://www.scopus.com/inward/record.uri?eid=2-s2.0-84924898378&doi=10.1144%2fSP399.18&partnerID=40&md5=01c817c5c3415b67bc6bbe8fb46772fa",Article,"Final","",Scopus,2-s2.0-84924898378
"Jara, P., Likerman, J., Winocur, D., Ghiglione, M.C., Cristallini, E.O., Pinto, L., Charrier, R.","56105673900;55598583300;55618729800;10038917000;7003564661;8084106600;6602474477;","Role of basin width variation in tectonic inversion: Insight from analogue modelling and implications for the tectonic inversion of the Abanico Basin, 32°-34°S, Central Andes",2015,"Geological Society Special Publication","399",,,"83","107",,11,"10.1144/SP399.7","https://www.scopus.com/inward/record.uri?eid=2-s2.0-84924897923&doi=10.1144%2fSP399.7&partnerID=40&md5=34e99503a24e73a22746c5a36daa4c85",Article,"Final","",Scopus,2-s2.0-84924897923
"Rodríguez, M.P., Aguilar, G., Urresty, C., Charrier, R.","55363828600;36624833300;56554162900;6602474477;","Neogene landscape evolution in the andes of north-central Chile between 28 and 32°S: Interplay between tectonic and erosional processes",2015,"Geological Society Special Publication","399",,,"419","446",,12,"10.1144/SP399.15","https://www.scopus.com/inward/record.uri?eid=2-s2.0-84924874153&doi=10.1144%2fSP399.15&partnerID=40&md5=7efd0ed858456283fdc4d4a7f81c1513",Article,"Final","",Scopus,2-s2.0-84924874153
"Hermanns, R.L., Fauqué, L., Wilson, C.G.J.","6603434500;6602398727;55477616600;","36Cl terrestrial cosmogenic nuclide dating suggests Late Pleistocene to Early Holocene mass movements on the south face of Aconcagua mountain and in the Las Cuevas-Horcones valleys, Central Andes, Argentina",2015,"Geological Society Special Publication","399",,,"345","368",,16,"10.1144/SP399.19","https://www.scopus.com/inward/record.uri?eid=2-s2.0-84924874134&doi=10.1144%2fSP399.19&partnerID=40&md5=6e2e4b45795ca1217f65e449db30e926",Article,"Final","All Open Access, Hybrid Gold, Green",Scopus,2-s2.0-84924874134
"Labarca, R., Gallardo, F.","33067966700;17341870200;","The domestic camelids (Cetartiodactyla: Camelidae) from the middle formative cemetery of topater 1 (Atacama Desert, Northern Chile): Osteometric and palaeopathological evidence of cargo animals",2015,"International Journal of Osteoarchaeology","25","1",,"61","73",,12,"10.1002/oa.2263","https://www.scopus.com/inward/record.uri?eid=2-s2.0-84922855783&doi=10.1002%2foa.2263&partnerID=40&md5=09d72c8daffe9f2c67add650b71f97aa",Article,"Final","",Scopus,2-s2.0-84922855783
"Ibáñez, S., Vidal, M.A., Ortiz, J.C., Torres-Pérez, F.","56506786400;7202765049;57190135164;7801421350;","Geometric morphometric analysis of the head of microlophus atacamensis (Tropiduridae) in a latitudinal gradient",2015,"Zoological Studies","54","1",,"","",8,3,"10.1186/s40555-014-0099-y","https://www.scopus.com/inward/record.uri?eid=2-s2.0-84922374519&doi=10.1186%2fs40555-014-0099-y&partnerID=40&md5=341c903bf156c2a8abf9c552756050b3",Article,"Final","All Open Access, Hybrid Gold, Green",Scopus,2-s2.0-84922374519
"Beck, S.L., Zandt, G., Ward, K.M., Scire, A.","35794532900;7003605105;54685448200;56490365600;","Multiple styles and scales of lithospheric foundering beneath the Puna Plateau, central Andes",2015,"Memoir of the Geological Society of America","212",,,"43","60",,47,"10.1130/2015.1212(03)","https://www.scopus.com/inward/record.uri?eid=2-s2.0-84921524264&doi=10.1130%2f2015.1212%2803%29&partnerID=40&md5=001d1e314f7282850cc51e813f709fd7",Article,"Final","",Scopus,2-s2.0-84921524264
"Engelder, T.M., Pelletier, J.D.","36172903600;7201763609;","Simulating foreland basin response to mountain belt kinematics and climate change in the Eastern Cordillera and Subandes: An analysis of the Chaco foreland basin in southern Bolivia",2015,"Memoir of the Geological Society of America","212",,,"337","357",,3,"10.1130/2015.1212(17)","https://www.scopus.com/inward/record.uri?eid=2-s2.0-84921520749&doi=10.1130%2f2015.1212%2817%29&partnerID=40&md5=11771ce46d7342e95819d502679b2de5",Article,"Final","",Scopus,2-s2.0-84921520749
"Quade, J., Dettinger, M.P., Carrapa, B., DeCelles, P., Murray, K.E., Huntington, K.W., Cartwright, A., Canavan, R.R., Gehrels, G., Clementz, M.","16194835700;55319480300;6506156162;7003358645;26664880900;15062831900;48461117500;36016034900;35548281700;6506986349;","The growth of the central Andes, 22°S-26°S",2015,"Memoir of the Geological Society of America","212",,,"277","308",,53,"10.1130/2015.1212(15)","https://www.scopus.com/inward/record.uri?eid=2-s2.0-84921509082&doi=10.1130%2f2015.1212%2815%29&partnerID=40&md5=6753c985a2b6c8c4b74f6494ee3b1fec",Article,"Final","",Scopus,2-s2.0-84921509082
"Becker, T.P., Summa, L.L., Ducea, M.N., Karner, G.D.","57201081057;7801524848;6701754095;7006563132;","Temporal growth of the Puna Plateau and its bearing on the post-Salta Rift system subsidence of the Andean foreland basin at 25°30′S",2015,"Memoir of the Geological Society of America","212",,,"407","433",,4,"10.1130/2015.1212(20)","https://www.scopus.com/inward/record.uri?eid=2-s2.0-84921505316&doi=10.1130%2f2015.1212%2820%29&partnerID=40&md5=d4a02b9d1fc7f0a660e9268ca1abf968",Article,"Final","",Scopus,2-s2.0-84921505316
"Summa, L., Becker, T., Gray, G., Awwiller, D.","7801524848;57201081057;7401812243;6508003186;","Evolving genetic concepts and their influence on hydrocarbon systems predictions, Subandean fold belt and deformed foreland, Argentina",2015,"Memoir of the Geological Society of America","212",,,"435","457",,1,"10.1130/2015.1212(21)","https://www.scopus.com/inward/record.uri?eid=2-s2.0-84921500686&doi=10.1130%2f2015.1212%2821%29&partnerID=40&md5=7d33a4cb2b1df001f8c08def2f759cdc",Article,"Final","",Scopus,2-s2.0-84921500686
"Metcalf, K., Kapp, P.","55519874400;7004726541;","Along-strike variations in crustal seismicity and modern lithospheric structure of the central Andean forearc",2015,"Memoir of the Geological Society of America","212",,,"61","78",,12,"10.1130/2015.1212(04)","https://www.scopus.com/inward/record.uri?eid=2-s2.0-84921477877&doi=10.1130%2f2015.1212%2804%29&partnerID=40&md5=589204cb647483ff5ddd2f5b3ff181d7",Article,"Final","",Scopus,2-s2.0-84921477877
"DeCelles, P.G., Carrapa, B., Horton, B.K., McNabb, J., Gehrels, G.E., Boyd, J.","7003358645;6506156162;7006721107;56490284400;35548281700;55439271200;","The Miocene Arizaro Basin, central Andean hinterland: Response to partial lithosphere removal?",2015,"Memoir of the Geological Society of America","212",,,"359","386",,40,"10.1130/2015.1212(18)","https://www.scopus.com/inward/record.uri?eid=2-s2.0-84921472313&doi=10.1130%2f2015.1212%2818%29&partnerID=40&md5=a43c85b396f8ff5e4518180ac3bbd412",Article,"Final","",Scopus,2-s2.0-84921472313
"Schoenbohm, L.M., Carrapa, B., McPherson, H.M., Pratt, J.R., Bywater-Reyes, S., Mortimer, E.","8148514600;6506156162;56490367600;56489689400;36070485200;9242501900;","Climate and tectonics along the southern margin of the Puna Plateau, NW Argentina: Origin of the late Cenozoic Punaschotter conglomerates",2015,"Memoir of the Geological Society of America","212",,,"251","260",,15,"10.1130/2015.1212(13)","https://www.scopus.com/inward/record.uri?eid=2-s2.0-84921462580&doi=10.1130%2f2015.1212%2813%29&partnerID=40&md5=57d8a66ef40d1e1ffe66633511940f84",Article,"Final","",Scopus,2-s2.0-84921462580
"Carrapa, B., DeCelles, P.G.","6506156162;7003358645;","Regional exhumation and kinematic history of the central Andes in response to cyclical orogenic processes",2015,"Memoir of the Geological Society of America","212",,,"201","213",,39,"10.1130/2015.1212(11)","https://www.scopus.com/inward/record.uri?eid=2-s2.0-84921462361&doi=10.1130%2f2015.1212%2811%29&partnerID=40&md5=2cd6c8e61ef59fca11fd9289cd144707",Article,"Final","",Scopus,2-s2.0-84921462361
"Schoenbohm, L.M., Carrapa, B.","8148514600;6506156162;","Miocene-Pliocene shortening, extension, and mafic magmatism support small-scale lithospheric foundering in the central Andes, NW Argentina",2015,"Memoir of the Geological Society of America","212",,,"167","180",,23,"10.1130/2015.1212(09)","https://www.scopus.com/inward/record.uri?eid=2-s2.0-84921452136&doi=10.1130%2f2015.1212%2809%29&partnerID=40&md5=3b465f003a025661614e8ef14adc1825",Article,"Final","",Scopus,2-s2.0-84921452136
"Einhorn, J.C., Gehrels, G.E., Vernon, A., DeCelles, P.G.","56490183300;35548281700;24178664400;7003358645;","U-Pb zircon geochronology of Neoproterozoic-Paleozoic sandstones and Paleozoic plutonic rocks in the Central Andes (21°S-26°S)",2015,"Memoir of the Geological Society of America","212",,,"115","124",,14,"10.1130/2015.1212(06)","https://www.scopus.com/inward/record.uri?eid=2-s2.0-84921451124&doi=10.1130%2f2015.1212%2806%29&partnerID=40&md5=51693979ef56dadbedd113c6c52866b1",Article,"Final","",Scopus,2-s2.0-84921451124
"Scire, A., Biryol, C.B., Zandt, G., Beck, S.","56490365600;37046843100;7003605105;35794532900;","Imaging the Nazca slab and surrounding mantle to 700 km depth beneath the central Andes (18°S to 28°S)",2015,"Memoir of the Geological Society of America","212",,,"23","41",,22,"10.1130/2015.1212(02)","https://www.scopus.com/inward/record.uri?eid=2-s2.0-84921449632&doi=10.1130%2f2015.1212%2802%29&partnerID=40&md5=4890e36763652dedbc81f61d4efc0b6a",Article,"Final","",Scopus,2-s2.0-84921449632
"Safipour, R., Carrapa, B., DeCelles, P.G., Thomson, S.N.","55985303500;6506156162;7003358645;35424868500;","Exhumation of the Precordillera and northern Sierras Pampeanas and along-strike correlation of the Andean orogenic front, northwestern Argentina",2015,"Memoir of the Geological Society of America","212",,,"181","199",,16,"10.1130/2015.1212(10)","https://www.scopus.com/inward/record.uri?eid=2-s2.0-84921443726&doi=10.1130%2f2015.1212%2810%29&partnerID=40&md5=2adc106a8cac349cd2cf3c700dfe6245",Article,"Final","",Scopus,2-s2.0-84921443726
"Gayo, E.M., Latorre, C., Santoro, C.M.","23392571300;7005764439;7004920399;","Timing of occupation and regional settlement patterns revealed by time-series analyses of an archaeological radiocarbon database for the South-Central Andes (16°-25°S)",2015,"Quaternary International","356",,,"4","14",,58,"10.1016/j.quaint.2014.09.076","https://www.scopus.com/inward/record.uri?eid=2-s2.0-84919625688&doi=10.1016%2fj.quaint.2014.09.076&partnerID=40&md5=4141dd3344b8588fb68432fe0594ebbf",Article,"Final","",Scopus,2-s2.0-84919625688
"Mujica, M.I., Latorre, C., Maldonado, A., González-Silvestre, L., Pinto, R., de Pol-Holz, R., Santoro, C.M.","57191543163;7005764439;8550634300;55960871600;56273147800;6505658565;7004920399;","Late Quaternary climate change, relict populations and present-day refugia in the northern Atacama Desert: A case study from Quebrada La Higuera (18° S)",2015,"Journal of Biogeography","42","1",,"76","88",,34,"10.1111/jbi.12383","https://www.scopus.com/inward/record.uri?eid=2-s2.0-84915768030&doi=10.1111%2fjbi.12383&partnerID=40&md5=9ffdec9bc6c75c636cf95699deadc5a5",Article,"Final","",Scopus,2-s2.0-84915768030
"Yáñez, J., Mansilla, H.D., Santander, I.P., Fierro, V., Cornejo, L., Barnes, R.M., Amarasiriwardena, D.","10144457000;7003787740;6701430138;10141402000;10140627900;55314697900;55394350000;","Urinary arsenic speciation profile in ethnic group of the Atacama desert (Chile) exposed to variable arsenic levels in drinking water",2015,"Journal of Environmental Science and Health - Part A Toxic/Hazardous Substances and Environmental Engineering","50","1",,"1","8",,11,"10.1080/10934529.2015.964594","https://www.scopus.com/inward/record.uri?eid=2-s2.0-84915746290&doi=10.1080%2f10934529.2015.964594&partnerID=40&md5=0591705e152a8f79c7aa0f917f9df8d8",Article,"Final","",Scopus,2-s2.0-84915746290
"Hernandez, J., Campos, C.M., Borghi, C.E.","56611183400;7102969438;7102731773;","Medicinal use of wild fauna by mestizo communities living near San Guillermo Biosphere Reserve (San Juan, Argentina)",2015,"Journal of Ethnobiology and Ethnomedicine","11","1","15","","",,12,"10.1186/1746-4269-11-15","https://www.scopus.com/inward/record.uri?eid=2-s2.0-84928712636&doi=10.1186%2f1746-4269-11-15&partnerID=40&md5=e36b9c18242fd1a1481e66a41df85bda",Article,"Final","All Open Access, Gold, Green",Scopus,2-s2.0-84928712636
"Frost, R.L., López, A., Scholz, R., Lana, C., Xi, Y.","55857720800;55577155700;8284272800;6602199051;8934713600;","A Raman spectroscopic study of the arsenate mineral chenevixite Cu 2Fe23+(AsO4)2(OH) 4·H2O",2015,"Spectrochimica Acta - Part A: Molecular and Biomolecular Spectroscopy","135",,,"192","197",,,"10.1016/j.saa.2014.06.091","https://www.scopus.com/inward/record.uri?eid=2-s2.0-84904994536&doi=10.1016%2fj.saa.2014.06.091&partnerID=40&md5=8ab29432563921ed5e7d6eae3e69799c",Article,"Final","All Open Access, Green",Scopus,2-s2.0-84904994536
"Kalazich, F.","57192187865;","Memory as archaeology: An experience of public archaeology in the Atacama Desert",2015,"Public Archaeology","14","1",,"44","65",,4,"10.1179/1465518715Z.00000000086","https://www.scopus.com/inward/record.uri?eid=2-s2.0-85000542392&doi=10.1179%2f1465518715Z.00000000086&partnerID=40&md5=ec50549cd07ac3af78efbd8b388fd1c7",Review,"Final","",Scopus,2-s2.0-85000542392
"Marsh, E.J.","56346348200;","The emergence of agropastoralism: Accelerated ecocultural change on the Andean altiplano, ∼3540-3120 cal BP",2015,"Environmental Archaeology","20","1",,"13","29",,23,"10.1179/1749631414Y.0000000036","https://www.scopus.com/inward/record.uri?eid=2-s2.0-84946172068&doi=10.1179%2f1749631414Y.0000000036&partnerID=40&md5=fa9fcc658653a9edec25c3768da5af9f",Article,"Final","",Scopus,2-s2.0-84946172068
"Sepúlveda, S.A., Moreiras, S.M., Lara, M., Alfaro, A.","8694415200;8240633800;35746399600;57209428518;","Debris flows in the Andean ranges of central Chile and Argentina triggered by 2013 summer storms: characteristics and consequences",2015,"Landslides","12","1",,"115","133",,28,"10.1007/s10346-014-0539-0","https://www.scopus.com/inward/record.uri?eid=2-s2.0-84925494705&doi=10.1007%2fs10346-014-0539-0&partnerID=40&md5=7d9fda6cb9a2aa5f1fbb8069935ad912",Article,"Final","All Open Access, Green",Scopus,2-s2.0-84925494705
"Munoz-Saez, C., Manga, M., Hurwitz, S., Rudolph, M.L., Namiki, A., Wang, C.-Y.","56104880000;7006760316;7101862011;25923060200;7202899105;7501631641;","Dynamics within geyser conduits, and sensitivity to environmental perturbations: Insights from a periodic geyser in the El Tatio geyser field, Atacama Desert, Chile",2015,"Journal of Volcanology and Geothermal Research","292",,,"41","55",,31,"10.1016/j.jvolgeores.2015.01.002","https://www.scopus.com/inward/record.uri?eid=2-s2.0-84922377504&doi=10.1016%2fj.jvolgeores.2015.01.002&partnerID=40&md5=1034c6e66adbf1008d5622d6f1d225e7",Article,"Final","All Open Access, Green",Scopus,2-s2.0-84922377504
"Comeau, M.J., Unsworth, M.J., Ticona, F., Sunagua, M.","56525001500;7005100237;54894587000;24829504900;","Magnetotelluric images of magma distribution beneath Volcán Uturuncu, Bolivia: Implications for magma dynamics",2015,"Geology","43","3",,"243","246",,82,"10.1130/G36258.1","https://www.scopus.com/inward/record.uri?eid=2-s2.0-84923311222&doi=10.1130%2fG36258.1&partnerID=40&md5=6583ff6082ad6bde0f72087dd27ea8c2",Article,"Final","",Scopus,2-s2.0-84923311222
"Matmon, A., Quade, J., Placzek, C., Fink, D., Copeland, A., Neilson, J.W.","6602501003;16194835700;8540533700;8602002800;55227053800;7101613134;","Seismic origin of the Atacama Desert boulder fields",2015,"Geomorphology","231",,,"28","39",,13,"10.1016/j.geomorph.2014.11.008","https://www.scopus.com/inward/record.uri?eid=2-s2.0-84921032574&doi=10.1016%2fj.geomorph.2014.11.008&partnerID=40&md5=d72d8f07d10c87bef33f39e16fd680f4",Article,"Final","",Scopus,2-s2.0-84921032574
"Weidmann, C., Gimenez, M., Klinger, F.L., Alvarez, O.","55777113300;7102141171;26536269000;48460956200;","Anomalous values of gravity and magnetism in the western margin of Gondwana",2015,"Tectonophysics","667",,,"1","15",,4,"10.1016/j.tecto.2015.11.017","https://www.scopus.com/inward/record.uri?eid=2-s2.0-84960467482&doi=10.1016%2fj.tecto.2015.11.017&partnerID=40&md5=f220b086ab149fab25b3b9b14d5c0440",Review,"Final","",Scopus,2-s2.0-84960467482
