"Burguener, G.F., Maldonado, M.J., Revale, S., Do Porto, D.F., Rascován, N., Vázquez, M., Farías, M.E., Marti, M.A., Turjanski, A.G.","57192160304;34067727700;43261703200;22940174000;26423986300;7401539904;35576859500;7103082873;6602847199;","Draft genome sequence of the polyextremophilic Halorubrum sp. strain AJ67, isolated from hyperarsenic lakes in the Argentinian Puna",2014,"Genome Announcements","2","1","e01096-13","","",,10,"10.1128/genomeA.e01096-13","https://www.scopus.com/inward/record.uri?eid=2-s2.0-84998829052&doi=10.1128%2fgenomeA.e01096-13&partnerID=40&md5=7e98d0d2508aa81223d1bb518e3a578a",Article,"Final","",Scopus,2-s2.0-84998829052
"Marinero, N.V., Cortez, R.O., Navarro, J.L., Martella, M.B.","57191220890;36486008900;56251081900;7004221683;","Density and abundance of rhea pennata garleppi (struthioniformes: Rheidae) in the puna ecoregion of Argentina",2014,"Revista Chilena de Historia Natural","87","1","17","","",,5,"10.1186/s40693-014-0017-z","https://www.scopus.com/inward/record.uri?eid=2-s2.0-84988039592&doi=10.1186%2fs40693-014-0017-z&partnerID=40&md5=eb6d8b2ad1844a68e4e4e26f53216b19",Article,"Final","All Open Access, Gold, Green",Scopus,2-s2.0-84988039592
"Arriaza, B., Standen, V.G., Heukelbach, J., Cassman, V., Olivares, F.","6602846124;6602356440;7004040208;8286793900;57191159904;","Head combs for delousing in ancient arican populations: Scratching for the evidence",2014,"Chungara","46","4",,"693","706",,4,"10.4067/S0717-73562014000400011","https://www.scopus.com/inward/record.uri?eid=2-s2.0-84987664715&doi=10.4067%2fS0717-73562014000400011&partnerID=40&md5=6410873a0e825ce52f69100a93e27c2a",Article,"Final","All Open Access, Bronze",Scopus,2-s2.0-84987664715
"Prieto, M., Vila, X.M.A.","56844665900;35209608200;","""Although the loneliness is great, greater yet is the love of my Country"": Archaeology of a military outpost on the Topaín Hillock (Antofagasta Region, Chile)",2014,"Journal of Contemporary Archaeology","1","2",,"323","350",,4,"10.1558/jca.v1i2.18435","https://www.scopus.com/inward/record.uri?eid=2-s2.0-84983110215&doi=10.1558%2fjca.v1i2.18435&partnerID=40&md5=ec6735e16dcd4479433d974900853375",Article,"Final","",Scopus,2-s2.0-84983110215
"Kolanowska, M.","55212728200;","A new species of Pterichis (Cranichideae, Orchidaceae) from Peru",2014,"Wulfenia","21",,,"49","54",,,,"https://www.scopus.com/inward/record.uri?eid=2-s2.0-84958540836&partnerID=40&md5=f252267a54e87df8f2054d0dfe0e7b6a",Article,"Final","",Scopus,2-s2.0-84958540836
"Crosta, G.B., Frattini, P., Valbuzzi, E., Valagussa, A., Hermanns, R.","7005690420;56538922400;56110087700;56290986100;6603434500;","Large slope instabilities in northern Chile: Inventory, characterization and possible triggers",2014,"Landslide Science for a Safer Geoenvironment: Volume 3: Targeted Landslides",,,,"175","181",,11,"10.1007/978-3-319-04996-0_28","https://www.scopus.com/inward/record.uri?eid=2-s2.0-84949568372&doi=10.1007%2f978-3-319-04996-0_28&partnerID=40&md5=749eaeb527763d28361ff7a14dfa6067",Book Chapter,"Final","",Scopus,2-s2.0-84949568372
"Bussmann, R.W., Sharon, D.","6603001909;16644071500;","Two decades of ethnobotanical research in Southern Ecuador and Northern Peru",2014,"Ethnobiology and Conservation","3","2014","3","","",,15,"10.15451/ec2014-6-3.2-1-50","https://www.scopus.com/inward/record.uri?eid=2-s2.0-84944398726&doi=10.15451%2fec2014-6-3.2-1-50&partnerID=40&md5=3b3fdeb843914e62de1df5d0a989df81",Article,"Final","All Open Access, Bronze",Scopus,2-s2.0-84944398726
"Quinteros, A.S., Valladares, P., Semham, R., Acosta, J.L., Barrionuevo, S., Abdala, C.S.","23390399200;6508032412;56805230400;57212973034;56805212400;14824794300;","A new species of liolaemus (Iguania: Liolaemidae) of the alticolor-bibronii group from Northern Chile",2014,"South American Journal of Herpetology","9","1",,"20","29",,9,"10.2994/SAJH-D-13-00040.1","https://www.scopus.com/inward/record.uri?eid=2-s2.0-84940281875&doi=10.2994%2fSAJH-D-13-00040.1&partnerID=40&md5=0b56f377260acd3f06bec853d30778db",Article,"Final","",Scopus,2-s2.0-84940281875
"Rosso, A.M.","36769109000;","Mummification in the ancient and new world [Mumifikacija u starominovom svijetu]",2014,"AMHA - Acta Medico-Historica Adriatica","12","2",,"329","370",,1,,"https://www.scopus.com/inward/record.uri?eid=2-s2.0-84940046742&partnerID=40&md5=683f2d3f7ef3c551b3fcc5842b197c4d",Article,"Final","",Scopus,2-s2.0-84940046742
"Azua-Bustos, A., González-Silva, C.","26038934900;35098616700;","Biotechnological Applications Derived from Microorganisms of the Atacama Desert",2014,"BioMed Research International","2014",,"909312","","",,16,"10.1155/2014/909312","https://www.scopus.com/inward/record.uri?eid=2-s2.0-84935894087&doi=10.1155%2f2014%2f909312&partnerID=40&md5=feb82fec791b851f195021d8408f1bb6",Review,"Final","All Open Access, Gold, Green",Scopus,2-s2.0-84935894087
"Capriles, J.M.","24066193900;","Mobile communities and pastoralist landscapes during the Formative period in the Central Altiplano of Bolivia",2014,"Latin American Antiquity","25","1",,"3","26",,17,"10.7183/1045-6635.25.1.3","https://www.scopus.com/inward/record.uri?eid=2-s2.0-84929675292&doi=10.7183%2f1045-6635.25.1.3&partnerID=40&md5=fd973712b5f4d9201b3fb53e02b9241a",Article,"Final","",Scopus,2-s2.0-84929675292
"Maidana, N.I., Seeligmann, C.T.","55902644100;6505952123;","Phytoplankton in high mountain wetlands of Argentina",2014,"Advances in Limnology","65",,,"23","35",,2,"10.1127/1612-166X/2014/0065-0032","https://www.scopus.com/inward/record.uri?eid=2-s2.0-84929322367&doi=10.1127%2f1612-166X%2f2014%2f0065-0032&partnerID=40&md5=dab3339c8008d81743f6084cb06a47e4",Article,"Final","",Scopus,2-s2.0-84929322367
"Collo, G., Dávila, F., Ezpeleta, M., Teixeira, W.","13411594200;6603700705;23100082300;57216575944;","U-Pb detrital ages on tuffaceous and sandstone levels from a neogene foreland basin of the central andes of Argentina [Idades U-Pb em zircões detríticos em níveis tufáceos e areníticos de uma bacia de antepaís neogénica nos andes centrais da Argentina]",2014,"Comunicacoes Geologicas","101",,,"405","407",,3,,"https://www.scopus.com/inward/record.uri?eid=2-s2.0-84929073698&partnerID=40&md5=5f4a355235d6b5bcbc1905831771de79",Article,"Final","",Scopus,2-s2.0-84929073698
"Cabana, G.S., Lewis, C.M., Tito, R.Y., Alan Covey, R., Cáceres, A.M., De La Cruz, A.F., Durand, D., Housman, G., Hulsey, B.I., Iannacone, G.C., López, P.W., Martínez, R., Medina, Á., Dávila, O.O., Pinto, K.P.O., Santillán, S.I.P., Domínguez, P.R., Rubel, M., Smith, H.F., Smith, S.E., De Celis Massa, V.R., Lizárraga, B., Stone, A.C.","14119420500;8585747300;8585746900;56575180100;13807271400;55910097900;56574724600;36767418800;55671560300;6507136918;7202454412;7402193385;57198314155;56575015000;56574878100;56574995600;56574819200;55326149100;9740963700;55501786600;56575156200;56893712800;7201354319;","Population genetic structure of traditional populations in the peruvian central andes and implications for South American population history",2014,"Human Biology","86","3",,"147","165",,22,"10.13110/humanbiology.86.3.0147","https://www.scopus.com/inward/record.uri?eid=2-s2.0-84925848835&doi=10.13110%2fhumanbiology.86.3.0147&partnerID=40&md5=c283c33ea0ddc5d1a77113f706e27d2a",Article,"Final","All Open Access, Green",Scopus,2-s2.0-84925848835
"Li, J., Donselaar, M.E., Hosseini Aria, S.E., Koenders, R., Oyen, A.M.","56479378200;6506053089;55522386000;25627905300;25924548000;","Landsat imagery-based visualization of the geomorphological development at the terminus of a dryland river system",2014,"Quaternary International","352","C",,"100","110",,33,"10.1016/j.quaint.2014.06.041","https://www.scopus.com/inward/record.uri?eid=2-s2.0-84925297187&doi=10.1016%2fj.quaint.2014.06.041&partnerID=40&md5=3d69fc7d36c82262df28445b4adfa692",Article,"Final","",Scopus,2-s2.0-84925297187
"Mantilla-Meluk, H., Siles, L., Aguirre, L.","35079150900;53980517000;57225376180;","Geographic and ecological amplitude in the nectarivorous bat anoura fistulata (pyhllostomidae: Glossophaginae) [Amplitud geográfica y ecológica en el murciélago nectarívoro Anoura fistulata (pyhllostomidae: glossophaginae)]",2014,"Caldasia","36","2",,"373","388",,5,"10.15446/caldasia/v36n2.47494","https://www.scopus.com/inward/record.uri?eid=2-s2.0-84924797608&doi=10.15446%2fcaldasia%2fv36n2.47494&partnerID=40&md5=219521da1060ef81ed5bd59f5486879b",Article,"Final","",Scopus,2-s2.0-84924797608
"Díaz-Vega, R.I.","56521733000;","Range extension of Liolaemus torresi (Núñez, Navarro, Garín, Pincheira-Donoso &amp; Meriggio, 2003) (Squamata: Liolaemidae) in the Atacama Desert, Chile",2014,"Check List","10","5",,"1234","1236",,2,"10.15560/10.5.1234","https://www.scopus.com/inward/record.uri?eid=2-s2.0-84923116041&doi=10.15560%2f10.5.1234&partnerID=40&md5=5d9abab3adf86a7aee23b16df7bab448",Article,"Final","All Open Access, Gold, Green",Scopus,2-s2.0-84923116041
"Ochyra, R., Bednarek-Ochyra, H.","56257223300;56168436500;","Dicranella hookeri (Dicranaceae, Bryophyta) in northern Argentina",2014,"Telopea","17",,,"331","335",,4,"10.7751/telopea20147998","https://www.scopus.com/inward/record.uri?eid=2-s2.0-84922828888&doi=10.7751%2ftelopea20147998&partnerID=40&md5=cd43945c79dede4d6e144a78940b6cd9",Article,"Final","",Scopus,2-s2.0-84922828888
"Winkel, T., Álvarez-Flores, R., Bertero, D., Cruz, P., del Castillo, C., Joffre, R., Peredo Parada, S., Sáez Tonacca, L.","36916561000;56033254500;6603139565;36337744900;14824723500;7003959661;56499357000;55669593700;","Calling for a reappraisal of the impact of quinoa expansion on agricultural sustainability in the Andean highlands [Llamado a una revaluación del impacto de la expansión del cultivo de quinua sobre la sostenibilidad agrícola en el altiplano andino]",2014,"Idesia","32","4",,"95","100",,10,"10.4067/S0718-34292014000400012","https://www.scopus.com/inward/record.uri?eid=2-s2.0-84921982423&doi=10.4067%2fS0718-34292014000400012&partnerID=40&md5=a9609bbcb359ce1462f26d5bc0d334e0",Article,"Final","All Open Access, Gold, Green",Scopus,2-s2.0-84921982423
"Carevic, F.S.","35767377800;","The role of ecophysiological studies in the genus Prosopis: Implications for the conservation of drought-prone species [Rol de los estudios ecofisiológicos en el género Prosopis: Implicaciones para la conservación de especies propensas a sequía]",2014,"Idesia","32","4",,"77","81",,11,"10.4067/S0718-34292014000400010","https://www.scopus.com/inward/record.uri?eid=2-s2.0-84921973734&doi=10.4067%2fS0718-34292014000400010&partnerID=40&md5=bd732d3ed3ca29f1c03852bf5c84aeaf",Article,"Final","All Open Access, Gold, Green",Scopus,2-s2.0-84921973734
"Grana, L.G.","57224462719;","Archeology and paleoenvironment: Social dynamics and environmental change in complex societies of the Puna Argentina [Arqueología y paleoambiente: Dinámica social y cambio ambiental en sociedades complejas de la puna Argentina]",2014,"Arqueologia","20","2",,"287","290",,1,,"https://www.scopus.com/inward/record.uri?eid=2-s2.0-84920113184&partnerID=40&md5=eac901319fdf57a34042a902b84c318e",Article,"Final","",Scopus,2-s2.0-84920113184
"Sieland, R.","30567797600;","Hydraulic investigations of the salar de uyuni, Bolivia",2014,"FOG - Freiberg Online Geoscience","37",,,"","",228,3,,"https://www.scopus.com/inward/record.uri?eid=2-s2.0-84920093302&partnerID=40&md5=471e17ed6a7bf83e29836e3ef65bfc93",Article,"Final","",Scopus,2-s2.0-84920093302
"Kühn, C., Küster, J., Brasse, H.","56462154400;56462383200;6603055906;","Three-dimensional inversion of magnetotelluric data from the Central Andean continental margin",2014,"Earth, Planets and Space","66","1","112","","",,18,"10.1186/1880-5981-66-112","https://www.scopus.com/inward/record.uri?eid=2-s2.0-84919930072&doi=10.1186%2f1880-5981-66-112&partnerID=40&md5=1fe00c0f120a30b93d8c24512ee3ca00",Article,"Final","All Open Access, Gold, Green",Scopus,2-s2.0-84919930072
"Suarez, V.H., Bertoni, E.A., Micheloud, J.F., Cafrune, M.M., Viñabal, A.E., Quiroga Roger, J., Bassanetti, A.F.","7006087169;56183011900;55914217600;8625656300;6507977480;56462964500;56462851200;","First record of Muellerius capillaris (Nematoda, Protostrongylidae) in northwestern Argentina",2014,"Helminthologia (Poland)","51","4",,"288","292",,3,"10.2478/s11687-014-0243-6","https://www.scopus.com/inward/record.uri?eid=2-s2.0-84919917816&doi=10.2478%2fs11687-014-0243-6&partnerID=40&md5=4b9e05f0362515bc639db798d4d7ad5b",Article,"Final","All Open Access, Gold",Scopus,2-s2.0-84919917816
"Entrocassi, G.S., Hormigo, D.F., Gavilán, R.G., Sánchez-Mata, D.","24079999200;56454286200;6602917435;6603642006;","Bioclimatic typology of Jujuy Province (Argentina)",2014,"Lazaroa","35",,,"7","18",,4,"10.5209/rev-LAZA.2014.v35.42366","https://www.scopus.com/inward/record.uri?eid=2-s2.0-84919418832&doi=10.5209%2frev-LAZA.2014.v35.42366&partnerID=40&md5=812fa67f8e10c95b0f2b50283ff82053",Article,"Final","",Scopus,2-s2.0-84919418832
"Sylvester, S.P., Sylvester, M.D.P.V., Kessler, M.","56123907500;56123659600;57203051832;","Inaccessible ledges as refuges for the natural vegetation of the high Andes",2014,"Journal of Vegetation Science","25","5",,"1225","1234",,28,"10.1111/jvs.12176","https://www.scopus.com/inward/record.uri?eid=2-s2.0-84919386300&doi=10.1111%2fjvs.12176&partnerID=40&md5=a9fbd0dd11fc64e9785fe784aab56f86",Article,"Final","",Scopus,2-s2.0-84919386300
"Despland, E.","6602142015;","Butterflies of the high-altitude Atacama desert: Habitat use and conservation",2014,"Frontiers in Genetics","5","SEP","334","","",,12,"10.3389/fgene.2014.00334","https://www.scopus.com/inward/record.uri?eid=2-s2.0-84918779649&doi=10.3389%2ffgene.2014.00334&partnerID=40&md5=2978d5ad0c922d55f0593b88e71d2e93",Article,"Final","All Open Access, Gold, Green",Scopus,2-s2.0-84918779649
"Chiou, K.L., Hastorf, C.A., Bonavia, D., Dillehay, T.D.","55652380100;6602921721;7801375722;6602089277;","Documenting Cultural Selection Pressure Changes on Chile Pepper (Capsicum baccatum L.) Seed Size Through Time in Coastal Peru (7,600 B.P.-Present)",2014,"Economic Botany","68","2",,"190","202",,15,"10.1007/s12231-014-9270-y","https://www.scopus.com/inward/record.uri?eid=2-s2.0-84908477580&doi=10.1007%2fs12231-014-9270-y&partnerID=40&md5=406a713b94570f8a540555d815d810da",Article,"Final","",Scopus,2-s2.0-84908477580
"Niemeyer, H., Meffre, S., Guerrero, R.","7006623436;57217263889;56397733600;","Zircon U-Pb geochronology of granitic rocks of the Cordón de Lila and Sierra de Almeida ranges, northern Chile: 30 m.y. of Ordovician plutonism on the western border of Gondwana",2014,"Journal of South American Earth Sciences","56",,,"228","241",,12,"10.1016/j.jsames.2014.09.011","https://www.scopus.com/inward/record.uri?eid=2-s2.0-84908327039&doi=10.1016%2fj.jsames.2014.09.011&partnerID=40&md5=14347dc271641ba2cad690bd28d2db2d",Article,"Final","",Scopus,2-s2.0-84908327039
"Knudson, K.J., Torres-Rouff, C.","35617354900;13204273900;","Cultural diversity and paleomobility in the Andean Middle Horizon: Radiogenic strontium isotope analyses in the San Pedro de Atacama oases of Northern Chile",2014,"Latin American Antiquity","25","2",,"170","188",,25,"10.7183/1045-6635.25.2.170","https://www.scopus.com/inward/record.uri?eid=2-s2.0-84908225535&doi=10.7183%2f1045-6635.25.2.170&partnerID=40&md5=0e680f305a612bc63711bc7833065529",Article,"Final","",Scopus,2-s2.0-84908225535
"Pizarro-Araya, J., Alfaro, F.M., Cortés-Contreras, M., Rivera, C., Vargas-Talciani, P., Ojanguren-Affilastro, A.A.","6507275792;34167465900;55546829400;56386879400;56387642500;56117639400;","Epigean insects of Chañaral Island (Pingüino de Humboldt National Reserve, Atacama, Chile)",2014,"Journal of the Entomological Research Society","16","2",,"39","50",,7,,"https://www.scopus.com/inward/record.uri?eid=2-s2.0-84908029324&partnerID=40&md5=9212230d3aaf7bf2ec7333b824e5bfc4",Article,"Final","",Scopus,2-s2.0-84908029324
"Suvires, G.M.","6506626498;","The paradigm of paraglacial megafans of the San Juan river basin, Central Andes, Argentina",2014,"Journal of South American Earth Sciences","55",,,"166","172",,17,"10.1016/j.jsames.2014.07.008","https://www.scopus.com/inward/record.uri?eid=2-s2.0-84907321755&doi=10.1016%2fj.jsames.2014.07.008&partnerID=40&md5=985a2166128eb5167fe92928eb765030",Article,"Final","",Scopus,2-s2.0-84907321755
"Vargas, H.A., Vargas-Ortiz, M., Huanca-Mamani, W., Hausmann, A.","14061478800;55577479900;6507340858;7003282177;","Prey identification in nests of the potter wasp Hypodynerus andeus (Packard) (Hymenoptera, Vespidae, Eumeninae) using DNA barcodes",2014,"Revista Brasileira de Entomologia","58","2",,"157","160",,11,"10.1590/S0085-56262014000200007","https://www.scopus.com/inward/record.uri?eid=2-s2.0-84906850200&doi=10.1590%2fS0085-56262014000200007&partnerID=40&md5=34c6061d480260b4011a1a7c591ad518",Article,"Final","All Open Access, Gold, Green",Scopus,2-s2.0-84906850200
"Maveety, S.A., Browne, R.A.","54945088100;7201586866;","Patterns of morphology in carabid beetles (Coleoptera: Carabidae) along a Neotropical altitudinal gradient",2014,"International Journal of Tropical Insect Science","34","3",,"157","171",,6,"10.1017/S1742758414000356","https://www.scopus.com/inward/record.uri?eid=2-s2.0-84906270099&doi=10.1017%2fS1742758414000356&partnerID=40&md5=1663fab06b636eef4fefa5cd5701448d",Review,"Final","",Scopus,2-s2.0-84906270099
"Walter, T.R., Motagh, M.","7102715022;12806388600;","Deflation and inflation of a large magma body beneath Uturuncu Volcano, Bolivia? Insights from InSAR data, surface lineaments and stress modelling",2014,"Geophysical Journal International","198","1",,"462","473",,22,"10.1093/gji/ggu080","https://www.scopus.com/inward/record.uri?eid=2-s2.0-84905911489&doi=10.1093%2fgji%2fggu080&partnerID=40&md5=0ca0de5fe34730658e2b41a7c53cf1ed",Article,"Final","All Open Access, Bronze, Green",Scopus,2-s2.0-84905911489
"Mendisco, F., Keyser, C., Seldes, V., Rivolta, C., Mercolli, P., Cruz, P., Nielsen, A.E., Crubezy, E., Ludes, B.","35389253200;6701371211;36931076000;56318979200;55177073000;36337744900;36105516200;6603671189;7006084980;","Genetic diversity of a late prehispanic group of the Quebrada de Humahuaca, Northwestern Argentina",2014,"Annals of Human Genetics","78","5",,"367","380",,14,"10.1111/ahg.12075","https://www.scopus.com/inward/record.uri?eid=2-s2.0-84905822733&doi=10.1111%2fahg.12075&partnerID=40&md5=8cc00eb19120fb4b80ae6446fa89c43c",Article,"Final","",Scopus,2-s2.0-84905822733
"Aschero, C.A., Izeta, A.D., Hocsman, S.","8623984100;35614839000;25635626800;","New Data on South American Camelid Bone Size Changes during Middle-Late Holocene Transition: Osteometry at Peñas Chicas 1.5 (Antofagasta de la Sierra, Argentinian Puna)",2014,"International Journal of Osteoarchaeology","24","4",,"492","504",,12,"10.1002/oa.2235","https://www.scopus.com/inward/record.uri?eid=2-s2.0-84905595374&doi=10.1002%2foa.2235&partnerID=40&md5=ba15c7a29761b84c0f19bc796aada601",Article,"Final","",Scopus,2-s2.0-84905595374
"Pokines, J.T.","6507249222;","Mammalian Microfaunal Remains from Khonkho Wankane (Late Formative Period), Mollo Kontu (Middle Horizon Period) and Pukara de Khonkho (Late Intermediate Period) in the Bolivian Altiplano",2014,"International Journal of Osteoarchaeology","24","4",,"505","516",,5,"10.1002/oa.2237","https://www.scopus.com/inward/record.uri?eid=2-s2.0-84905568373&doi=10.1002%2foa.2237&partnerID=40&md5=597e1b78438e6517b596d5e8948f9622",Article,"Final","",Scopus,2-s2.0-84905568373
"Campón, F.F., Silnik, S.L., Fedeli, L.A.","22953115900;34168387100;57017745600;","Scorpion diversity of the Central Andes in Argentina",2014,"Journal of Arachnology","42","2",,"163","169",,5,"10.1636/P13-30.1","https://www.scopus.com/inward/record.uri?eid=2-s2.0-84905447917&doi=10.1636%2fP13-30.1&partnerID=40&md5=935837eb9e74347977b0a04078bea503",Article,"Final","All Open Access, Green",Scopus,2-s2.0-84905447917
"Patzelt, D.J., Hodač, L., Friedl, T., Pietrasiak, N., Johansen, J.R.","56201348700;12646037700;6701327644;55014517800;7201410810;","Biodiversity of soil cyanobacteria in the hyper-arid Atacama Desert, Chile",2014,"Journal of Phycology","50","4",,"698","710",,52,"10.1111/jpy.12196","https://www.scopus.com/inward/record.uri?eid=2-s2.0-84905269280&doi=10.1111%2fjpy.12196&partnerID=40&md5=5edd6131c2fe64a3350ade1f2ec675a5",Article,"Final","",Scopus,2-s2.0-84905269280
"Pingel, H., Alonso, R.N., Mulch, A., Rohrmann, A., Sudo, M., Strecker, M.R.","37085371000;7201754112;12242513500;37095899000;7102210423;7006301675;","Pliocene orographic barrier uplift in the southern Central Andes",2014,"Geology","42","8",,"691","694",,40,"10.1130/G35538.1","https://www.scopus.com/inward/record.uri?eid=2-s2.0-84905180299&doi=10.1130%2fG35538.1&partnerID=40&md5=9a26b3f9dc58bf656d7db4e023d4fcca",Article,"Final","",Scopus,2-s2.0-84905180299
"Guhl, F., Auderheide, A., Ramírez, J.D.","55581213200;56108973200;35741723300;","From ancient to contemporary molecular eco-epidemiology of Chagas disease in the Americas",2014,"International Journal for Parasitology","44","9",,"605","612",,29,"10.1016/j.ijpara.2014.02.005","https://www.scopus.com/inward/record.uri?eid=2-s2.0-84905044501&doi=10.1016%2fj.ijpara.2014.02.005&partnerID=40&md5=3db667cf62573b9f5d26d7332e2e8f48",Article,"Final","",Scopus,2-s2.0-84905044501
"Sáez, P.A., Fibla, P., Correa, C., Sallaberry, M., Salinas, H., Veloso, A., Mella, J., Iturra, P., Méndez, M.A.","36786237400;55613929500;7006952125;23104179300;57214379435;7003736298;6603115708;6602490416;55762292600;","A new endemic lineage of the Andean frog genus Telmatobius (Anura, Telmatobiidae) from the western slopes of the central Andes",2014,"Zoological Journal of the Linnean Society","171","4",,"769","782",,30,"10.1111/zoj.12152","https://www.scopus.com/inward/record.uri?eid=2-s2.0-84904766521&doi=10.1111%2fzoj.12152&partnerID=40&md5=10559dc8d0eb872dd4195df470587df0",Article,"Final","All Open Access, Bronze",Scopus,2-s2.0-84904766521
"Jara, C., Gaete, H., Lobos, G., Hidalgo, M.E.","56997397900;21740442700;55410121700;7101655009;","Oxidative stress in the mollusk Echinolittorina peruviana (Gasteropoda: Littorinidae, Lamarck, 1822) and trace metals in coastal sectors with mining activity",2014,"Ecotoxicology","23","6",,"1099","1108",,10,"10.1007/s10646-014-1253-3","https://www.scopus.com/inward/record.uri?eid=2-s2.0-84904740392&doi=10.1007%2fs10646-014-1253-3&partnerID=40&md5=9b33c10e01efed3bc284c8a808dc8239",Article,"Final","",Scopus,2-s2.0-84904740392
"Quispe-Peña, E.C., Poma-Gutiérrez, A.G., McGregor, B.A., Bartolomé-Filella, J.","55839021800;56288395900;7006950467;7101720351;","Effect of genotype and sex on fiber growth rate of alpacas for their first year of fleece production",2014,"Archivos de Medicina Veterinaria","46","1",,"151","155",,4,"10.4067/S0301-732X2014000100021","https://www.scopus.com/inward/record.uri?eid=2-s2.0-84904667058&doi=10.4067%2fS0301-732X2014000100021&partnerID=40&md5=2459aca2173a3a7c0e2987758758a761",Article,"Final","All Open Access, Bronze, Green",Scopus,2-s2.0-84904667058
"Sanabria, J., Calanca, P., Alarcón, C., Canchari, G.","55355425800;57207497242;56054279600;56054655400;","Potential impacts of early twenty-first century changes in temperature and precipitation on rainfed annual crops in the Central Andes of Peru",2014,"Regional Environmental Change","14","4",,"1533","1548",,8,"10.1007/s10113-014-0595-y","https://www.scopus.com/inward/record.uri?eid=2-s2.0-84904659582&doi=10.1007%2fs10113-014-0595-y&partnerID=40&md5=0f61ffe8320fe99afb5446dc89dd3c53",Article,"Final","",Scopus,2-s2.0-84904659582
"Lowman, L.E.L., Barros, A.P.","56287490900;7102745183;","Investigating links between climate and orography in the central Andes: Coupling erosion and precipitation using a physical-statistical model",2014,"Journal of Geophysical Research: Earth Surface","119","6",,"1322","1353",,17,"10.1002/2013JF002940","https://www.scopus.com/inward/record.uri?eid=2-s2.0-84904595086&doi=10.1002%2f2013JF002940&partnerID=40&md5=97fe7fa29c6f5e9fd831b8e0c37e3471",Article,"Final","All Open Access, Bronze",Scopus,2-s2.0-84904595086
"Cruz-Jofré, F., Vilina, Y.A.","55971834600;6507306492;","Trophic ecology of Athene cunicularia (Aves: Strigidae) in an island system of northern Chile: ¿potential numerical and functional response related to Pelecanoides garnotii (Aves: Pelecanoididae)? [Ecología trófi ca de Athene cunicularia (Aves: Strigidae) en un sistema insular del norte de Chile: ¿posible respuesta funcional y numérica frente a Pelecanoides garnotii (Aves: Pelecanoididae)?]",2014,"Gayana","78","1",,"31","40",,7,"10.4067/S0717-65382014000100005","https://www.scopus.com/inward/record.uri?eid=2-s2.0-84904391258&doi=10.4067%2fS0717-65382014000100005&partnerID=40&md5=26d22e91c6cd21b537863cde0bc2fef8",Article,"Final","All Open Access, Bronze, Green",Scopus,2-s2.0-84904391258
"Cruz-Jofré, F., Morales, P., Esquer-Garrigos, Y., Vila, I., Hugueny, B., Gaubert, P., Méndez, M.A.","55971834600;22938070000;22034132200;6701661179;6701515769;6603443283;55762292600;","Taxonomic identity of the forms of Orestias agassii (Teleostei: Cyprinodontidae) from Chile: A morphological comparison with the syntypes of the species of Peru and Bolivia [Identidad taxonómica de las formas de Orestias agassii (Teleostei: Cyprinodontidae) de Chile: Una comparación morfológica con los sintipos de la especie de Perú y Bolivia]",2014,"Gayana","78","1",,"41","45",,3,"10.4067/S0717-65382014000100006","https://www.scopus.com/inward/record.uri?eid=2-s2.0-84904389498&doi=10.4067%2fS0717-65382014000100006&partnerID=40&md5=e919772d2233bed6727416404a7513d5",Article,"Final","All Open Access, Bronze, Green",Scopus,2-s2.0-84904389498
