"Kotzé, P.","8316925500;","Squeezing water out of fog",2012,"Water Wheel","11","3",,"30","32",,,,"https://www.scopus.com/inward/record.uri?eid=2-s2.0-84863459489&partnerID=40&md5=6d51e3e2811aa50d7d22e1ef573445c4",Article,"Final","",Scopus,2-s2.0-84863459489
"Goepfert, N.","55270302000;","New zooarchaeological and funerary perspectives on Mochica culture (A.D. 100-800), Peru",2012,"Journal of Field Archaeology","37","2",,"104","120",,27,"10.1179/0093469012Z.00000000010","https://www.scopus.com/inward/record.uri?eid=2-s2.0-84863105845&doi=10.1179%2f0093469012Z.00000000010&partnerID=40&md5=e7ce2ccc386ffa3f303139f18f9f9b52",Review,"Final","",Scopus,2-s2.0-84863105845
"Orts, D.L., Folguera, A., Giménez, M., Ramos, V.A.","40561498000;6602569951;7102141171;7006122908;","Variable structural controls through time in the Southern Central Andes (~36°S) [Controles estructurales variables en el tiempo en los Andes Centrales Australes (~36°S)]",2012,"Andean Geology","39","2",,"220","241",,27,,"https://www.scopus.com/inward/record.uri?eid=2-s2.0-84861912628&partnerID=40&md5=fde463ce3c156e7174fc7282542a4126",Article,"Final","",Scopus,2-s2.0-84861912628
"Benites, J., Gutierrez, E., López, J., Rojas, M., Rojo, L., Do Céu Costa, M., Vinardelld, M.P., Calderon, P.B.","7801468635;55229833200;7404444440;57197533688;14059010200;57214811828;55229381000;7004185980;","Evaluation of analgesic activities of tremetone derivatives isolated from the chilean altiplano medicine Parastrephia lepidophylla",2012,"Natural Product Communications","7","5",,"611","614",,15,"10.1177/1934578x1200700517","https://www.scopus.com/inward/record.uri?eid=2-s2.0-84861496024&doi=10.1177%2f1934578x1200700517&partnerID=40&md5=d2b039c138821cfc4d1205496799e719",Article,"Final","All Open Access, Bronze",Scopus,2-s2.0-84861496024
"Gonzales, C., Leiva-Revilla, J., Rubio, J., Gasco, M., Gonzales, G.F.","9040676500;36182936700;7202580502;7006338361;7007038828;","Effect of red maca (Lepidium meyenii) on prostate zinc levels in rats with testosterone-induced prostatic hyperplasia",2012,"Andrologia","44","SUPPL.1",,"362","369",,15,"10.1111/j.1439-0272.2011.01190.x","https://www.scopus.com/inward/record.uri?eid=2-s2.0-84861495933&doi=10.1111%2fj.1439-0272.2011.01190.x&partnerID=40&md5=7b000e283c92d79936311fa2bd42ae78",Article,"Final","",Scopus,2-s2.0-84861495933
"Neilson, J.W., Quade, J., Ortiz, M., Nelson, W.M., Legatzki, A., Tian, F., LaComb, M., Betancourt, J.L., Wing, R.A., Soderlund, C.A., Maier, R.M.","7101613134;16194835700;55158432000;35407139500;6508142692;57204477140;55183629700;7005037015;7103122467;7003725782;7201868017;","Life at the hyperarid margin: Novel bacterial diversity in arid soils of the Atacama Desert, Chile",2012,"Extremophiles","16","3",,"553","566",,127,"10.1007/s00792-012-0454-z","https://www.scopus.com/inward/record.uri?eid=2-s2.0-84860838112&doi=10.1007%2fs00792-012-0454-z&partnerID=40&md5=3b73141546aff008be3cc36256fcf27f",Article,"Final","",Scopus,2-s2.0-84860838112
"Lara, J., González, L.E., Ferrero, M., Díaz, G.C., Pedrós-Alió, C., Demergasso, C.","55213692800;55213704700;7102652838;7201671416;7005923874;35228899200;","Enrichment of arsenic transforming and resistant heterotrophic bacteria from sediments of two salt lakes in Northern Chile",2012,"Extremophiles","16","3",,"523","538",,30,"10.1007/s00792-012-0452-1","https://www.scopus.com/inward/record.uri?eid=2-s2.0-84860834179&doi=10.1007%2fs00792-012-0452-1&partnerID=40&md5=22fd9a8833664d994a21eeabdb79191b",Article,"Final","",Scopus,2-s2.0-84860834179
"Jay, J.A., Pritchard, M.E., West, M.E., Christensen, D., Haney, M., Minaya, E., Sunagua, M., McNutt, S.R., Zabala, M.","57220446416;15623796000;36103769600;7201640668;57192854328;8351612400;24829504900;7003427177;54400628800;","Shallow seismicity, triggered seismicity, and ambient noise tomography at the long-dormant Uturuncu Volcano, Bolivia",2012,"Bulletin of Volcanology","74","4",,"817","837",,67,"10.1007/s00445-011-0568-7","https://www.scopus.com/inward/record.uri?eid=2-s2.0-84860315830&doi=10.1007%2fs00445-011-0568-7&partnerID=40&md5=c8a58e2eb9c4d83c835f282db8d1986f",Article,"Final","",Scopus,2-s2.0-84860315830
"Mosca Torres, M.E., Puig, S.","35103070800;7005260636;","Habitat use and selection by the vicuña (Vicugna vicugna, Camelidae) during summer and winter in the High Andean Puna of Argentina",2012,"Small Ruminant Research","104","1-3",,"17","27",,6,"10.1016/j.smallrumres.2011.11.002","https://www.scopus.com/inward/record.uri?eid=2-s2.0-84859973768&doi=10.1016%2fj.smallrumres.2011.11.002&partnerID=40&md5=fc5143a4e62a43ad34770fc2a3dfcb70",Article,"Final","",Scopus,2-s2.0-84859973768
"Borthagaray, A.I., Arim, M., Marquet, P.A.","8982534400;6602916632;7102630622;","Connecting landscape structure and patterns in body size distributions",2012,"Oikos","121","5",,"697","710",,28,"10.1111/j.1600-0706.2011.19548.x","https://www.scopus.com/inward/record.uri?eid=2-s2.0-84859712204&doi=10.1111%2fj.1600-0706.2011.19548.x&partnerID=40&md5=c927a8f44aef26c4de9bd5958c06dcde",Article,"Final","",Scopus,2-s2.0-84859712204
"Larraín, T., Escobar, R.","34880160500;8619161300;","Net energy analysis for concentrated solar power plants in northern Chile",2012,"Renewable Energy","41",,,"123","133",,29,"10.1016/j.renene.2011.10.015","https://www.scopus.com/inward/record.uri?eid=2-s2.0-84155170757&doi=10.1016%2fj.renene.2011.10.015&partnerID=40&md5=1bb9fcad06429e1d6454d559120ba00f",Article,"Final","",Scopus,2-s2.0-84155170757
"Pigati, J.S., Latorre, C., Rech, J.A., Betancourt, J.L., Martínez, K.E., Budahn, J.R.","6507461206;7005764439;7003316537;7005037015;55213492000;6602133778;","Accumulation of impact markers in desert wetlands and implications for the Younger Dryas impact hypothesis",2012,"Proceedings of the National Academy of Sciences of the United States of America","109","19",,"7208","7212",,36,"10.1073/pnas.1200296109","https://www.scopus.com/inward/record.uri?eid=2-s2.0-84860826469&doi=10.1073%2fpnas.1200296109&partnerID=40&md5=637ba3baea25bb79ff2732212d7d112f",Article,"Final","All Open Access, Bronze, Green",Scopus,2-s2.0-84860826469
"Ruch, J., Warren, J.K., Risacher, F., Walter, T.R., Lanari, R.","24171798700;7402212086;6701690110;7102715022;7003896636;","Salt lake deformation detected from space",2012,"Earth and Planetary Science Letters","331-332",,,"120","127",,9,"10.1016/j.epsl.2012.03.009","https://www.scopus.com/inward/record.uri?eid=2-s2.0-84860621161&doi=10.1016%2fj.epsl.2012.03.009&partnerID=40&md5=a823c5d29af56508b82c7841c188a771",Article,"Final","",Scopus,2-s2.0-84860621161
"Nado, K.L., Marsteller, S.J., King, L.M., Daverman, B.M., Torres-Rouff, C., Knudson, K.J.","55618879900;50861625400;55068045500;55240044700;13204273900;35617354900;","Examining local social identities through Patterns of biological and cultural variation In the solcor Ayllu, San Pedro de Atacama, chile",2012,"Chungara","44","2",,"341","357",,23,"10.4067/S0717-73562012000200010","https://www.scopus.com/inward/record.uri?eid=2-s2.0-84874795276&doi=10.4067%2fS0717-73562012000200010&partnerID=40&md5=0d9c41b3998514a119179daf645a2c44",Article,"Final","All Open Access, Gold, Green",Scopus,2-s2.0-84874795276
"García-Guzman, P., Loayza, A.P., Carvajal, D.E., Letelier, L., Squeo, F.A.","55512102800;24598247300;56081126000;24767582500;6507048631;","The ecology, distribution and conservation status of Myrcianthes coquimbensis: A globally endangered endemic shrub of the Chilean Coastal Desert",2012,"Plant Ecology and Diversity","5","2",,"197","204",,12,"10.1080/17550874.2011.583286","https://www.scopus.com/inward/record.uri?eid=2-s2.0-84870600898&doi=10.1080%2f17550874.2011.583286&partnerID=40&md5=2decbf620511f38074c3d6e9267332ec",Article,"Final","",Scopus,2-s2.0-84870600898
"Albarracín, V.H., Pathak, G.P., Douki, T., Cadet, J., Borsarelli, C.D., Gärtner, W., Farias, M.E.","8533180000;37001825000;7005604022;35421128300;6701786603;7006584462;35576859500;","Extremophilic Acinetobacter Strains from High-Altitude Lakes in Argentinean Puna: Remarkable UV-B Resistance and Efficient DNA Damage Repair",2012,"Origins of Life and Evolution of Biospheres","42","2",,"201","221",,49,"10.1007/s11084-012-9276-3","https://www.scopus.com/inward/record.uri?eid=2-s2.0-84864283024&doi=10.1007%2fs11084-012-9276-3&partnerID=40&md5=a6544bdebc0a48659aefb9c79a43a97b",Article,"Final","",Scopus,2-s2.0-84864283024
"Stivaletta, N., Barbieri, R., Billi, D.","14036536800;7202282568;6602426429;","Microbial Colonization of the Salt Deposits in the Driest Place of the Atacama Desert (Chile)",2012,"Origins of Life and Evolution of Biospheres","42","2",,"187","200",,26,"10.1007/s11084-012-9289-y","https://www.scopus.com/inward/record.uri?eid=2-s2.0-84864279258&doi=10.1007%2fs11084-012-9289-y&partnerID=40&md5=bd218565734148346dc261a857fe6ec5",Article,"Final","",Scopus,2-s2.0-84864279258
"Lynch, R.C., King, A.J., Farías, M.E., Sowell, P., Vitry, C., Schmidt, S.K.","37018311000;55713660000;35576859500;15766106500;57195558216;7401845551;","The potential for microbial life in the highest-elevation (&gt;6000m.a.s.l.) mineral soils of the Atacama region",2012,"Journal of Geophysical Research: Biogeosciences","117","2","G02028","","",,64,"10.1029/2012JG001961","https://www.scopus.com/inward/record.uri?eid=2-s2.0-84862982952&doi=10.1029%2f2012JG001961&partnerID=40&md5=462addc5a08b5f6a4961fc9137f9b657",Article,"Final","",Scopus,2-s2.0-84862982952
"Vargas Castillo, R., Beck, A.","55212485200;56652991300;","Photobiont selectivity and specificity in Caloplaca species in a fog-induced community in the Atacama Desert, northern Chile",2012,"Fungal Biology","116","6",,"665","676",,50,"10.1016/j.funbio.2012.04.001","https://www.scopus.com/inward/record.uri?eid=2-s2.0-84861664073&doi=10.1016%2fj.funbio.2012.04.001&partnerID=40&md5=fa99a992ccce56a1b3087d13135fc21d",Article,"Final","",Scopus,2-s2.0-84861664073
"Lloyd, H., Sevillano Ríos, S., Marsden, S.J., Valdés-Velásquez, A.","7005408392;53064622000;7006832332;37023744700;","Bird community composition across an Andean tree-line ecotone",2012,"Austral Ecology","37","4",,"470","478",,11,"10.1111/j.1442-9993.2011.02308.x","https://www.scopus.com/inward/record.uri?eid=2-s2.0-84861483141&doi=10.1111%2fj.1442-9993.2011.02308.x&partnerID=40&md5=3b74d299eef89297c70cccad6347d564",Article,"Final","",Scopus,2-s2.0-84861483141
"Uehara, M., Gattacceca, J., Rochette, P., Demory, F., Valenzuela, E.M.","57204298653;6603540166;7006811225;8599495100;55224908100;","Magnetic study of meteorites recovered in the Atacama desert (Chile): Implications for meteorite paleomagnetism and the stability of hot desert surfaces",2012,"Physics of the Earth and Planetary Interiors","200-201",,,"113","123",,10,"10.1016/j.pepi.2012.04.007","https://www.scopus.com/inward/record.uri?eid=2-s2.0-84861335390&doi=10.1016%2fj.pepi.2012.04.007&partnerID=40&md5=4d311719e42ac3d455106ecc77670bb8",Article,"Final","",Scopus,2-s2.0-84861335390
"Mcglue, M.M., Ellis, G.S., Cohen, A.S., Swarzenski, P.W.","14028657200;8912353100;7404780058;6602074836;","Playa-lake sedimentation and organic matter accumulation in an Andean piggyback basin: The recent record from the Cuenca de Pozuelos, North-west Argentina",2012,"Sedimentology","59","4",,"1237","1256",,26,"10.1111/j.1365-3091.2011.01304.x","https://www.scopus.com/inward/record.uri?eid=2-s2.0-84861190269&doi=10.1111%2fj.1365-3091.2011.01304.x&partnerID=40&md5=063c0e127758e40cdd8663cd94db15f7",Article,"Final","",Scopus,2-s2.0-84861190269
"Viruel, J., Catalán, P., Segarra-Moragues, J.G.","25825777700;7004599565;6602593251;","Disrupted phylogeographical microsatellite and chloroplast DNA patterns indicate a vicariance rather than long-distance dispersal origin for the disjunct distribution of the Chilean endemic Dioscorea biloba (Dioscoreaceae) around the Atacama Desert",2012,"Journal of Biogeography","39","6",,"1073","1085",,16,"10.1111/j.1365-2699.2011.02658.x","https://www.scopus.com/inward/record.uri?eid=2-s2.0-84861182336&doi=10.1111%2fj.1365-2699.2011.02658.x&partnerID=40&md5=99af72a43a694074aa3d575fbeed2e9b",Article,"Final","",Scopus,2-s2.0-84861182336
"Ramos Ramos, O.E., Cáceres, L.F., Ormachea Muñoz, M.R., Bhattacharya, P., Quino, I., Quintanilla, J., Sracek, O., Thunvik, R., Bundschuh, J., García, M.E.","49864320100;36740206700;49864339900;57197831645;49864222200;37073193800;6507304767;6603392714;6602540559;57198924678;","Sources and behavior of arsenic and trace elements in groundwater and surface water in the Poopó Lake Basin, Bolivian Altiplano",2012,"Environmental Earth Sciences","66","3",,"793","807",,41,"10.1007/s12665-011-1288-1","https://www.scopus.com/inward/record.uri?eid=2-s2.0-84861182279&doi=10.1007%2fs12665-011-1288-1&partnerID=40&md5=ff6df4033f805b0cea71b1c74f7e2ad3",Article,"Final","",Scopus,2-s2.0-84861182279
"Flores, G.E., Pizarro-Araya, J.","7101819691;6507275792;","Systematic revision of the South american genus Praocis Eschscholtz, 1829 (Coleoptera: Tenebrionidae). Part 1: Introduction and subgenus Praocis S. str.",2012,"Zootaxa",,"3336",,"1","35",,16,"10.11646/zootaxa.3336.1.1","https://www.scopus.com/inward/record.uri?eid=2-s2.0-84861895008&doi=10.11646%2fzootaxa.3336.1.1&partnerID=40&md5=d777753395a3718a02b62c0a9ccd4693",Review,"Final","",Scopus,2-s2.0-84861895008
"Amundson, R., Dietrich, W., Bellugi, D., Ewing, S., Nishiizumi, K., Chong, G., Owen, J., Finkel, R., Heimsath, A., Stewart, B., Caffee, M.","7005994343;7201810208;14053474200;15044347400;7004197106;55340362300;15045266600;34869459600;6603159701;7202105882;7005913149;","Geomorphologic evidence for the late Pliocene onset of hyperaridity in the Atacama Desert",2012,"Bulletin of the Geological Society of America","124","7-8",,"1048","1070",,79,"10.1130/B30445.1","https://www.scopus.com/inward/record.uri?eid=2-s2.0-84865165939&doi=10.1130%2fB30445.1&partnerID=40&md5=9f38ff7c1b3fd4e32bcf226df9b6a062",Article,"Final","",Scopus,2-s2.0-84865165939
"Giambiagi, L., Mescua, J., Bechis, F., Tassara, A., Hoke, G.","6603448181;16316918800;16315074400;6701640620;7003530133;","Thrust belts of the southern Central Andes: Along-strike variations in shortening, topography, crustal geometry, and denudation",2012,"Bulletin of the Geological Society of America","124","7-8",,"1339","1351",,75,"10.1130/B30609.1","https://www.scopus.com/inward/record.uri?eid=2-s2.0-84865165276&doi=10.1130%2fB30609.1&partnerID=40&md5=0dd911cbf4601bb859776cc1595a6d3e",Article,"Final","",Scopus,2-s2.0-84865165276
"Knudson, K.J., Pestle, W.J., Torres-Rouff, C., Pimentel, G.","35617354900;14036084300;13204273900;25633156000;","Assessing the life history of an andean traveller through biogeochemistry: Stable and radiogenic isotope analyses of archaeological human remains from northern chile",2012,"International Journal of Osteoarchaeology","22","4",,"435","451",,68,"10.1002/oa.1217","https://www.scopus.com/inward/record.uri?eid=2-s2.0-84864855115&doi=10.1002%2foa.1217&partnerID=40&md5=0b4e4217bcfaa98200f5bee0864f8075",Article,"Final","",Scopus,2-s2.0-84864855115
"Gayo, E.M., Latorre, C., Jordan, T.E., Nester, P.L., Estay, S.A., Ojeda, K.F., Santoro, C.M.","23392571300;7005764439;7202381241;6507620314;24399013400;55330569600;7004920399;","Late Quaternary hydrological and ecological changes in the hyperarid core of the northern Atacama Desert (~21°S)",2012,"Earth-Science Reviews","113","3-4",,"120","140",,100,"10.1016/j.earscirev.2012.04.003","https://www.scopus.com/inward/record.uri?eid=2-s2.0-84864770561&doi=10.1016%2fj.earscirev.2012.04.003&partnerID=40&md5=19d83289f921b767f45ee239d9b10576",Review,"Final","",Scopus,2-s2.0-84864770561
"Qin, Y., Li, Y., Bao, H., Liu, F., Hou, K., Wan, D., Zhang, C.","57198579649;57211832476;7102201467;55512686700;24331813800;7103411712;57221301076;","Massive atmospheric nitrate accumulation in a continental interior desert, Northwestern China",2012,"Geology","40","7",,"623","626",,27,"10.1130/G32953.1","https://www.scopus.com/inward/record.uri?eid=2-s2.0-84864323776&doi=10.1130%2fG32953.1&partnerID=40&md5=cfe9be25cb2f402705c9f95d00c0b3c6",Article,"Final","",Scopus,2-s2.0-84864323776
"Padial, J.M., Chaparro, J.C., Castroviejo-Fisher, S., Guayasamin, J.M., Lehr, E., Delgado, A.J., Vaira, M., Teixeira Jr., M., Aguayo, R., Riva, I.D.L.","8507062200;14038746700;16678263500;6603035688;7003323573;55321126300;55984411400;36897562000;24482934600;7003724243;","A revision of species diversity in the neotropical genus Oreobates (Anura: Strabomantidae), with the description of three new species from the amazonian slopes of the andes",2012,"American Museum Novitates",,"3752",,"1","55",,48,"10.1206/3752.2","https://www.scopus.com/inward/record.uri?eid=2-s2.0-84864206465&doi=10.1206%2f3752.2&partnerID=40&md5=702fc854095f66cca9c124af1ab63c41",Article,"Final","All Open Access, Green",Scopus,2-s2.0-84864206465
"Hall, S.R., Farber, D.L., Audin, L., Finkel, R.C.","24366724000;35581716700;7005114252;34869459600;","Recently active contractile deformation in the forearc of southern Peru",2012,"Earth and Planetary Science Letters","337-338",,,"85","92",,22,"10.1016/j.epsl.2012.04.007","https://www.scopus.com/inward/record.uri?eid=2-s2.0-84862330726&doi=10.1016%2fj.epsl.2012.04.007&partnerID=40&md5=aee8e723cdf013c55aeb6ae85fad2bb2",Article,"Final","",Scopus,2-s2.0-84862330726
"Valdivia-Silva, J.E., Navarro-González, R., Fletcher, L., Perez-Montaño, S., Condori-Apaza, R., McKay, C.P.","26323939900;7003446002;25640548200;36931293100;36930036800;7101952183;","Soil carbon distribution and site characteristics in hyper-arid soils of the Atacama Desert: A site with Mars-like soils",2012,"Advances in Space Research","50","1",,"108","122",,20,"10.1016/j.asr.2012.03.003","https://www.scopus.com/inward/record.uri?eid=2-s2.0-84861199515&doi=10.1016%2fj.asr.2012.03.003&partnerID=40&md5=547f3a39473fbe284c09aa025e70df5e",Article,"Final","",Scopus,2-s2.0-84861199515
"Muñoz García, M.A., Faz Cano, A.","41662013300;6506495282;","Soil organic matter stocks and quality at high altitude grasslands of Apolobamba, Bolivia",2012,"Catena","94",,,"26","35",,15,"10.1016/j.catena.2011.06.007","https://www.scopus.com/inward/record.uri?eid=2-s2.0-84859162294&doi=10.1016%2fj.catena.2011.06.007&partnerID=40&md5=02867cfbf81535142b45b110f13f3d67",Article,"Final","",Scopus,2-s2.0-84859162294
"Ortega-Baes, P., Bravo, S., Sajama, J., Sühring, S., Arrueta, J., Sotola, E., Alonso-Pedano, M., Godoy-Bürki, A.C., Frizza, N.R., Galíndez, G., Gorostiague, P., Barrionuevo, A., Scopel, A.","6506956720;56464839000;55123203800;7801643214;55123203600;55123205400;55123205500;55123205200;55956233400;16401136900;55123205300;55120002600;6701536946;","Intensive field surveys in conservation planning: Priorities for cactus diversity in the Saltenian Calchaquíes Valleys (Argentina)",2012,"Journal of Arid Environments","82",,,"91","97",,10,"10.1016/j.jaridenv.2012.02.005","https://www.scopus.com/inward/record.uri?eid=2-s2.0-84858724312&doi=10.1016%2fj.jaridenv.2012.02.005&partnerID=40&md5=f14c55bd0647ec0f11f9c69c3c88b3e9",Article,"Final","",Scopus,2-s2.0-84858724312
"Wierzchos, J., Davila, A.F., Sánchez-Almazo, I.M., Hajnos, M., Swieboda, R., Ascaso, C.","7003681791;7006340868;6506485044;7003518626;6602798291;7005936696;","Novel water source for endolithic life in the hyperarid core of the Atacama Desert",2012,"Biogeosciences","9","6",,"2275","2286",,39,"10.5194/bg-9-2275-2012","https://www.scopus.com/inward/record.uri?eid=2-s2.0-84863304171&doi=10.5194%2fbg-9-2275-2012&partnerID=40&md5=9f918451cd9c2067ae132f970f61e103",Article,"Final","All Open Access, Gold, Green",Scopus,2-s2.0-84863304171
"Mitchell, T.M., Faulkner, D.R.","39262157300;7201970222;","Towards quantifying the matrix permeability of fault damage zones in low porosity rocks",2012,"Earth and Planetary Science Letters","339-340",,,"24","31",,128,"10.1016/j.epsl.2012.05.014","https://www.scopus.com/inward/record.uri?eid=2-s2.0-84862994972&doi=10.1016%2fj.epsl.2012.05.014&partnerID=40&md5=63387f1a2d4977a48f1fcae9ce98fad4",Article,"Final","",Scopus,2-s2.0-84862994972
[No author name available],[No author id available],"Transportation: Quick takes: Gas Atacama awards Chilean FSRU to Golar LNG",2012,"Oil and Gas Journal","110","7 B",,"13","",,,,"https://www.scopus.com/inward/record.uri?eid=2-s2.0-85117432946&partnerID=40&md5=d58efec0f4b146a8248a8ae921c61c66",Note,"Final","",Scopus,2-s2.0-85117432946
"Villegas, F., Angles, R., Barrientos, R., Barrios, G., Valero, M.A., Hamed, K., Grueninger, H., Ault, S.K., Montresor, A., Engels, D., Mas-Coma, S., Gabrielli, A.F.","55353624000;6701587700;57215732950;57215735449;7102334544;6701358148;44761187500;10140552300;7003965054;56253523700;7003404234;56227363300;","Administration of Triclabendazole Is Safe and Effective in Controlling Fascioliasis in an Endemic Community of the Bolivian Altiplano",2012,"PLoS Neglected Tropical Diseases","6","8","e1720","","",,53,"10.1371/journal.pntd.0001720","https://www.scopus.com/inward/record.uri?eid=2-s2.0-84865959816&doi=10.1371%2fjournal.pntd.0001720&partnerID=40&md5=b3c739198b2fd6a5d38b33a8369c9382",Article,"Final","All Open Access, Gold, Green",Scopus,2-s2.0-84865959816
"Collado, G.A., Mendez, M.A.","8697105300;55762292600;","Phylogenetic relationships and taxonomy of Altiplano populations of Biomphalaria (Gastropoda: Planorbidae): Inference from a multilocus approach",2012,"Zoological Journal of the Linnean Society","165","4",,"795","808",,12,"10.1111/j.1096-3642.2012.00829.x","https://www.scopus.com/inward/record.uri?eid=2-s2.0-84864317918&doi=10.1111%2fj.1096-3642.2012.00829.x&partnerID=40&md5=c4c64173f59342e423fae067a5e5f227",Article,"Final","All Open Access, Bronze",Scopus,2-s2.0-84864317918
"Costa Tártara, S.M., Manifesto, M.M., Bramardi, S.J., Bertero, H.D.","36464769400;6504673609;8656302200;6603139565;","Genetic structure in cultivated quinoa (Chenopodium quinoa Willd.), a reflection of landscape structure in Northwest Argentina",2012,"Conservation Genetics","13","4",,"1027","1038",,21,"10.1007/s10592-012-0350-1","https://www.scopus.com/inward/record.uri?eid=2-s2.0-84864312117&doi=10.1007%2fs10592-012-0350-1&partnerID=40&md5=71e73285ad2254b2328ec5285dcd0711",Article,"Final","All Open Access, Green",Scopus,2-s2.0-84864312117
"Adolf, V.I., Shabala, S., Andersen, M.N., Razzaghi, F., Jacobsen, S.-E.","37076666500;55924154000;6506450736;26030614400;8607369400;","Varietal differences of quinoa's tolerance to saline conditions",2012,"Plant and Soil","357","1",,"117","129",,115,"10.1007/s11104-012-1133-7","https://www.scopus.com/inward/record.uri?eid=2-s2.0-84864153288&doi=10.1007%2fs11104-012-1133-7&partnerID=40&md5=a82632cc52a8ba55844d625e6b22b0e6",Article,"Final","",Scopus,2-s2.0-84864153288
"Santimano, T., Riller, U.","36626165300;57222541658;","Kinematics of Tertiary to Quaternary intracontinental deformation of upper crust in the Eastern Cordillera, southern Central Andes, NW Argentina",2012,"Tectonics","31","4","TC4002","","",,14,"10.1029/2011TC003068","https://www.scopus.com/inward/record.uri?eid=2-s2.0-84863903409&doi=10.1029%2f2011TC003068&partnerID=40&md5=b0cccfd33320d64aecce04a2df469fbf",Article,"Final","",Scopus,2-s2.0-84863903409
"Lugo, M.A., Negritto, M.A., Jofré, M., Anton, A., Galetto, L.","7003805668;24587091100;6602734190;7101672430;7003995510;","Colonization of native Andean grasses by arbuscular mycorrhizal fungi in Puna: A matter of altitude, host photosynthetic pathway and host life cycles",2012,"FEMS Microbiology Ecology","81","2",,"455","466",,22,"10.1111/j.1574-6941.2012.01373.x","https://www.scopus.com/inward/record.uri?eid=2-s2.0-84863781706&doi=10.1111%2fj.1574-6941.2012.01373.x&partnerID=40&md5=9b02134af1d05a448faa6efbcd6fb3ac",Article,"Final","All Open Access, Green",Scopus,2-s2.0-84863781706
"Meira, V.T., Campos Neto, M.D.C., González, P.D., Stipp Basei, M.Â., Varela, R.","36666754100;8742531300;7202330873;6602668732;7006361578;","Ordovician klippen structures of the Sierra de Umango: New insights on Tectonic evolution of the Western Sierras Pampeanas, Argentina",2012,"Journal of South American Earth Sciences","37",,,"154","174",,8,"10.1016/j.jsames.2012.02.002","https://www.scopus.com/inward/record.uri?eid=2-s2.0-84860517605&doi=10.1016%2fj.jsames.2012.02.002&partnerID=40&md5=440987c6b418f4fda6d86f4fe21a4e6a",Article,"Final","All Open Access, Green",Scopus,2-s2.0-84860517605
"Somoza, R., Tomlinson, A.J., Caffe, P.J., Vilas, J.F.","6602622330;7101953404;6506303993;7004174175;","Paleomagnetic evidence of earliest Paleocene deformation in Calama (∼22°S), northern Chile: Andean-type or ridge-collision tectonics?",2012,"Journal of South American Earth Sciences","37",,,"208","213",,15,"10.1016/j.jsames.2012.04.001","https://www.scopus.com/inward/record.uri?eid=2-s2.0-84860354320&doi=10.1016%2fj.jsames.2012.04.001&partnerID=40&md5=b54f08ebd07fea9d616325d9d11629c8",Article,"Final","",Scopus,2-s2.0-84860354320
"Cristofolini, E.A., Otamendi, J.E., Ducea, M.N., Pearson, D.M., Tibaldi, A.M., Baliani, I.","36061534600;6603624937;6701754095;55314397900;7003575367;49060950500;","Detrital zircon U-Pb ages of metasedimentary rocks from Sierra de Valle Fértil: Entrapment of Middle and Late Cambrian marine successions in the deep roots of the Early Ordovician Famatinian arc",2012,"Journal of South American Earth Sciences","37",,,"77","94",,35,"10.1016/j.jsames.2012.02.001","https://www.scopus.com/inward/record.uri?eid=2-s2.0-84858264472&doi=10.1016%2fj.jsames.2012.02.001&partnerID=40&md5=83431eb7a88c453c80b4c1c9e7559abd",Article,"Final","",Scopus,2-s2.0-84858264472
